name,gender,age,class,embarked,country,ticketno,fare,sibsp,parch,survived
"Abbing, Mr. Anthony",male,42,3rd,S,United States,5547,7.11,0,0,0
"Abbott, Mr. Eugene Joseph",male,13,3rd,S,United States,2673,20.05,0,2,0
"Abbott, Mr. Rossmore Edward",male,16,3rd,S,United States,2673,20.05,1,1,0
"Abbott, Mrs. Rhoda Mary 'Rosa'",female,39,3rd,S,England,2673,20.05,1,1,1
"Abelseth, Miss. Karen Marie",female,16,3rd,S,Norway,348125,7.13,0,0,1
"Abelseth, Mr. Olaus Jørgensen",male,25,3rd,S,United States,348122,7.13,0,0,1
"Abelson, Mr. Samuel",male,30,2nd,C,France,3381,24,1,0,0
"Abelson, Mrs. Hannah",female,28,2nd,C,France,3381,24,1,0,1
"Abī-Al-Munà, Mr. Nāsīf Qāsim",male,27,3rd,C,Lebanon,2699,18.1509,0,0,1
"Abrahamsson, Mr. Abraham August Johannes",male,20,3rd,S,Finland,3101284,7.1806,0,0,1
"Ådahl, Mr. Mauritz",male,30,3rd,S,Sweden,7076,7.05,0,0,0
"Adams, Mr. John",male,27,3rd,S,England,341826,8.01,0,0,0
"Ahlin, Mrs. Johanna Persdotter",female,40,3rd,S,Sweden,7546,9.0906,1,0,0
"Aks, Master. Frank Philip",male,0.8333333333,3rd,S,England,392091,9.07,0,1,1
"Aks, Mrs. Leah",female,18,3rd,S,England,392091,9.07,0,1,1
"Aldworth, Mr. Augustus Henry",male,35,2nd,S,England,248744,13,0,0,0
"Alexander, Mr. William Albert",male,25,3rd,S,England,3474,7.1709,0,0,0
"Alhomäki, Mr. Ilmari Rudolf",male,19,3rd,S,Finland,3101287,7.1806,0,0,0
"Ali, Mr. Ahmed",male,24,3rd,S,Argentina,3101311,7.01,0,0,0
"Ali, Mr. William",male,25,3rd,S,Argentina,3101312,7.01,0,0,0
"Allen, Miss. Elisabeth Walton",female,29,1st,S,United States,24160,211.6009,0,0,1
"Allen, Mr. William Henry",male,39,3rd,S,England,373450,8.01,0,0,0
"Allison, Master. Hudson Trevor",male,0.9166666667,1st,S,Canada,113781,151.16,1,2,1
"Allison, Miss. Helen Loraine",female,2,1st,S,Canada,113781,151.16,1,2,0
"Allison, Mr. Hudson Joshua Creighton",male,30,1st,S,Canada,113781,151.16,1,2,0
"Allison, Mrs. Bessie Waldo",female,25,1st,S,United States,113781,151.16,1,2,0
"Allum, Mr. Owen George",male,18,3rd,S,England,2223,8.06,0,0,0
"Al-Munà, Mr. Farīd Husayn Qāsim",male,19,3rd,C,Lebanon,2700,7.0407,0,0,0
"Andersen-Jensen, Miss. Carla Christine Nielsine",female,19,3rd,S,Denmark,350046,7.1701,1,0,1
"Andersen, Mr. Albert Karvin",male,33,3rd,S,Norway,4001,22.1006,0,0,0
"Anderson, Mr. Harry",male,47,1st,S,United States,19952,26.11,0,0,1
"Andersson, Master. Sigvard Harald Elias",male,4,3rd,S,Sweden,347082,31.0506,4,2,0
"Andersson, Miss. Ebba Iris Alfrida",female,6,3rd,S,Sweden,347082,31.0506,4,2,0
"Andersson, Miss. Ellis Anna Maria",female,2,3rd,S,Sweden,347082,31.0506,4,2,0
"Andersson, Miss. Erna Alexandra",female,16,3rd,S,Finland,3101281,7.1806,4,2,1
"Andersson, Miss. Ida Augusta Margareta",female,38,3rd,S,Sweden,347091,7.1506,4,2,0
"Andersson, Miss. Ingeborg Constanzia",female,9,3rd,S,Sweden,347082,31.0506,4,2,0
"Andersson, Miss. Sigrid Elisabeth",female,11,3rd,S,Sweden,347082,31.0506,4,2,0
"Andersson, Mr. Anders Johan",male,39,3rd,S,Sweden,347082,31.0506,1,5,0
"Andersson, Mr. Johan Samuel",male,26,3rd,S,Sweden,347075,7.1506,0,0,0
"Andersson, Mrs. Alfrida Konstantia Brogren",female,39,3rd,S,Sweden,347082,31.0506,1,5,0
"Andreasson, Mr. Pål Edvin",male,20,3rd,S,Sweden,347466,7.1701,0,0,0
"Andrew, Mr. Edgar Samuel",male,17,2nd,S,Argentina,231945,11.1,0,0,0
"Andrew, Mr. Frank Thomas",male,27,2nd,S,England,34050,10.1,0,0,0
"Andrews, Miss. Kornelia Theodosia",female,62,1st,C,United States,13502,77.1902,1,0,1
"Andrews, Mr. Thomas",male,39,1st,B,Northern Ireland,112050,NA,0,0,0
"Angheloff, Mr. Minko",male,26,3rd,S,Bulgaria,349202,7.1711,0,0,0
"Angle, Mrs. Florence Agnes",female,36,2nd,S,England,226875,26,1,0,1
"Angle, Mr. William",male,31,2nd,S,England,226875,26,1,0,0
"Appleton, Mrs. Charlotte",female,53,1st,S,United States,11769,51.0907,2,0,1
"Arnold-Franchi, Mr. Josef",male,25,3rd,S,Switzerland,349237,17.16,1,0,0
"Arnold-Franchi, Mrs. Josefine",female,18,3rd,S,Switzerland,349237,17.16,1,0,0
"Aronsson, Mr. Ernst Axel Algot",male,25,3rd,S,Sweden,349911,7.1506,0,0,0
"Artagaveytia, Mr. Ramon",male,71,1st,C,Argentina,17609,49.1001,0,0,0
"Ashby, Mr. John",male,57,2nd,S,England,244346,13,0,0,0
"Asim, Mr. Adola",male,35,3rd,S,Argentina,3101310,7.01,0,0,0
"Asplund, Master. Carl Edgar",male,5,3rd,S,Sweden,347077,31.0709,4,2,0
"Asplund, Master. Clarence Gustaf Hugo",male,9,3rd,S,Sweden,347077,31.0709,4,2,0
"Asplund, Master. Edvin Rojj Felix",male,3,3rd,S,Sweden,347077,31.0709,4,2,1
"Asplund, Master. Filip Oscar",male,13,3rd,S,Sweden,347077,31.0709,4,2,0
"Asplund, Miss. Lillian Gertrud",female,5,3rd,S,Sweden,347077,31.0709,4,2,1
"Asplund, Mr. Carl Oscar Vilhelm Gustafsson",male,40,3rd,S,Sweden,347077,31.0709,1,5,0
"Asplund, Mr. Johan Charles",male,23,3rd,S,Sweden,350054,7.1511,0,0,1
"Asplund, Mrs. Selma Augusta Emilia",female,38,3rd,S,Sweden,347077,31.0709,1,5,1
"Assaf, Mrs. Mariana",female,45,3rd,C,Lebanon,2696,7.0406,0,0,1
"Assam, Mr. Ali",male,23,3rd,S,Argentina,3101309,7.01,0,0,0
"Astor, Colonel. John Jacob",male,47,1st,C,United States,17757,247.1006,1,0,0
"Astor, Mrs. Madeleine Talmage",female,18,1st,C,United States,17757,247.1006,1,0,1
"Attalah, Miss. Malake",female,17,3rd,C,Lebanon,2627,14.0902,0,0,0
"Attala, Mr. Sleiman",male,27,3rd,C,Canada,2694,7.0406,0,0,0
"Aubart, Mme. Léontine Pauline",female,24,1st,C,France,17477,69.06,0,0,1
"Augustsson, Mr. Albert",male,23,3rd,S,Sweden,347468,7.1701,0,0,0
"Ayoub Daher, Miss. Banoura",female,15,3rd,C,Lebanon,2687,7.0407,0,0,1
"Backström, Mr. Karl Alfred",male,32,3rd,S,Finland,3101278,15.17,1,0,0
"Backström, Mrs. Maria Mathilda",female,33,3rd,S,Finland,3101278,15.17,3,0,1
"Baclini, Miss. Eugenie",female,3,3rd,C,Lebanon,2666,19.0502,2,1,1
"Baclini, Miss. Helene Barbara",female,0.75,3rd,C,Lebanon,2666,19.0502,2,1,1
"Baclini, Miss. Marie Catherine",female,5,3rd,C,Lebanon,2666,19.0502,2,1,1
"Baclini, Mrs. Latifa",female,23,3rd,C,Lebanon,2666,19.0502,0,3,1
"Badman, Miss. Emily Louisa",female,18,3rd,S,England,31416,8.01,0,0,1
"Badt, Mr. Mohamed",male,40,3rd,C,Lebanon,2623,7.0406,0,0,0
"Bailey, Mr. Percy",male,18,2nd,S,England,29108,11.1,0,0,0
"Bainbrigge, Mr. Charles Robert",male,22,2nd,S,Channel Islands,31030,10.1,0,0,0
"Balkic, Mr. Cerin",male,26,3rd,S,Bosnia,349248,7.1711,0,0,0
"Balls, Mrs. Ada E.",female,36,2nd,S,England,28551,13,0,0,1
"Banfield, Mr. Frederick James",male,28,2nd,S,England,34068,10.1,0,0,0
"Banski, Mrs. Mara",female,31,3rd,S,Hungary,349244,8.1308,0,0,1
"Barbara, Miss. Saiide",female,18,3rd,C,Lebanon,2691,14.0901,0,1,0
"Barbara, Mrs. Catherine David",female,45,3rd,C,Lebanon,2691,14.0901,0,1,0
"Barber, Miss. Ellen Mary",female,27,1st,S,NA,19877,78.17,0,0,1
"Barkworth, Mr. Algernon Henry",male,47,1st,S,England,27042,30,0,0,1
"Barry, Miss. Julia",female,30,3rd,Q,Ireland,330844,7.1707,0,0,0
"Barton, Mr. David John",male,22,3rd,S,England,324669,8.01,0,0,0
"Bassani, Mrs. Albina",female,32,1st,C,Italy,11813,76.051,0,0,1
"Bateman, Revd. Robert James",male,52,2nd,S,England,1166,12.1006,0,0,0
"Batoshev, Mr. Hristo Lalev",male,23,3rd,S,Bulgaria,349217,7.1711,0,0,0
"Baumann, Mr. John D.",male,60,1st,C,United States,17318,25.1806,0,0,0
"Baxter, Mr. Quigg Edmond",male,24,1st,C,Canada,17558,247.1005,0,1,0
"Baxter, Mrs. Hélène",female,50,1st,C,Canada,17558,247.1005,0,1,1
"Beane, Mr. Edward",male,32,2nd,S,England,2908,26,1,0,1
"Beane, Mrs. Ethel",female,22,2nd,S,England,2908,26,1,0,1
"Beattie, Mr. Thomson",male,36,1st,S,Canada,13050,75.041,0,0,0
"Beauchamp, Mr. Henry James",male,44,2nd,S,England,244358,26,0,0,0
"Beavan, Mr. William Thomas",male,20,3rd,S,England,323951,8.01,0,0,0
"Becker, Master. Richard F.",male,1,2nd,S,India,230136,39,2,1,1
"Becker, Miss. Marion Louise",female,4,2nd,S,India,230136,39,2,1,1
"Becker, Miss. Ruth Elizabeth",female,12,2nd,S,India,230136,39,2,1,1
"Becker, Mrs. Nellie E.",female,35,2nd,S,United States,230136,39,0,3,1
"Beckwith, Mr. Richard Leonard",male,37,1st,S,United States,11751,52.1101,1,1,1
"Beckwith, Mrs. Sallie",female,46,1st,S,United States,11751,52.1101,1,1,1
"Beesley, Mr. Lawrence",male,34,2nd,S,England,248698,13,0,0,1
"Behr, Mr. Karl Howell",male,26,1st,C,United States,111369,30,0,0,1
"Bengtsson, Mr. Johan Viktor",male,26,3rd,S,Sweden,347068,7.1506,0,0,0
"Bentham, Miss. Lillian W.",female,19,2nd,S,United States,28404,13,0,0,1
"Berglund, Mr. Karl Ivar Sven",male,22,3rd,S,Finland,4348,9.07,0,0,0
"Berriman, Mr. William John",male,23,2nd,S,England,28425,13,0,0,0
"Bessette, Miss. Nellie Mayo",female,39,1st,C,United States,17760,63.0702,0,0,1
"Bidois, Miss. Rosalie",female,46,1st,C,NA,17757,247.1006,0,0,1
"Bing, Mr. Lee",male,32,3rd,S,NA,1601,56.0911,0,0,1
"Bird, Miss. Ellen",female,31,1st,S,England,17483,221.1507,0,0,1
"Birkeland, Mr. Hans Martin Monsen",male,21,3rd,S,Norway,312992,7.1506,0,0,0
"Birnbaum, Mr. Jakob",male,24,1st,C,NA,13905,26,0,0,0
"Bishop, Mr. Dickinson H.",male,25,1st,C,United States,11967,91.0107,1,0,1
"Bishop, Mrs. Helen",female,19,1st,C,United States,11967,91.0107,1,0,1
"Björklund, Mr. Ernst Herbert",male,18,3rd,S,Sweden,347090,7.15,0,0,0
"Björnström-Steffansson, Mr. Mauritz Hokan",male,28,1st,S,Sweden,110564,26.11,0,0,1
"Blackwell, Mr. Stephen Weart",male,45,1st,S,United States,113784,35.1,0,0,0
"Blank, Mr. Henry",male,39,1st,C,United States,112277,31,0,0,1
"Bonnell, Miss. Caroline",female,30,1st,S,United States,36928,164.1704,0,0,1
"Bonnell, Miss. Elizabeth",female,61,1st,S,England,113783,26.11,0,0,1
"Borebank, Mr. John James",male,41,1st,S,England,110489,26.11,0,0,0
"Bostandyeff, Mr. Guentcho",male,26,3rd,S,NA,349224,7.1711,0,0,0
"Botsford, Mr. William Hull",male,25,2nd,S,United States,237670,13,0,0,0
"Bourke, Miss. Mary",female,40,3rd,Q,Ireland,364848,7.15,0,2,0
"Bourke, Mr. John",male,42,3rd,Q,Ireland,364849,15.1,1,1,0
"Bourke, Mrs. Catherine",female,32,3rd,Q,Ireland,364849,15.1,1,1,0
"Bowen, Miss. Grace Scott",female,45,1st,C,United States,17608,262.0706,0,0,1
"Bowen, Mr. David John 'Dai'",male,26,3rd,S,Wales,54636,16.02,0,0,0
"Bowenur, Mr. Solomon",male,42,2nd,S,NA,211535,13,0,0,0
"Bowerman, Miss. Elsie Edith",female,22,1st,S,England,113505,55,0,1,1
"Bracken, Mr. James Hollen",male,30,2nd,S,United States,220367,13,0,0,0
"Bradley, Miss. Bridget Delia",female,22,3rd,Q,Ireland,334914,7.1406,0,0,1
"Brady, Mr. John Bertram",male,41,1st,S,United States,113054,30.1,0,0,0
"Braf, Miss. Elin Ester Maria",female,20,3rd,S,Sweden,347471,7.1701,0,0,0
"Brailey, Mr. William Theodore Ronald",male,24,2nd,S,England,250654,NA,NA,NA,0
"Brandeis, Mr. Emil Franklin",male,48,1st,C,United States,17591,50.0911,0,0,0
"Braund, Mr. Lewis Richard",male,29,3rd,S,England,3460,7,1,0,0
"Braund, Mr. Owen Harris",male,23,3rd,S,England,21171,7.05,1,0,0
"Brereton, Mr. George Andrew",male,37,1st,S,United States,111427,26.11,0,0,1
"Brewe, Dr. Arthur Jackson",male,46,1st,C,United States,112379,39.12,0,0,0
"Bricoux, Mr. Roger Marie",male,20,2nd,S,France,250654,NA,NA,NA,0
"Brito, Mr. José Joaquim de",male,32,2nd,S,NA,244360,13,0,0,0
"Brobäck, Mr. Karl Rudolf",male,22,3rd,S,Sweden,350045,7.1511,0,0,0
"Brocklebank, Mr. William Alfred",male,40,3rd,S,England,364512,8.01,0,0,0
"Brown, Miss. Amelia Mary",female,18,2nd,S,England,248733,13,0,0,1
"Brown, Miss. Edith Eileen",female,15,2nd,S,South Africa,29750,39,0,2,1
"Brown, Mrs. Caroline Lane",female,59,1st,S,United States,11769,51.0907,2,0,1
"Brown, Mrs. Elizabeth Catherine",female,40,2nd,S,South Africa,29750,39,1,1,1
"Brown, Mrs. Margaret",female,44,1st,C,United States,17610,27.1405,0,0,1
"Brown, Mr. Thomas William Solomon",male,60,2nd,S,South Africa,29750,39,1,1,0
"Bryhl, Miss. Dagmar Jenny Ingeborg",female,20,2nd,S,Sweden,236853,26,1,0,1
"Bryhl, Mr. Kurt Arnold Gottfrid",male,25,2nd,S,Sweden,236853,26,1,0,0
"Buckley, Miss. Katherine",female,22,3rd,Q,Ireland,329944,7.0508,0,0,0
"Buckley, Mr. Daniel",male,21,3rd,Q,Ireland,330920,7.1517,0,0,1
"Bucknell, Mrs. Emma Eliza",female,58,1st,C,India,11813,76.051,0,0,1
"Būlus, Master. Akar",male,7,3rd,C,Lebanon,2678,15.0411,1,1,0
"Būlus, Miss. Nūr al-'ayn",female,10,3rd,C,Lebanon,2678,15.0411,1,1,0
"Būlus, Mrs. Sultānah",female,40,3rd,C,Lebanon,2678,15.0411,0,2,0
"Burke, Mr. Jeremiah",male,19,3rd,Q,Ireland,365222,6.15,0,0,0
"Burns, Miss. Elizabeth Margaret",female,41,1st,C,NA,16966,134.1,0,0,1
"Burns, Miss. Mary Delia",female,17,3rd,Q,Ireland,330963,7.1707,0,0,0
"Buss, Miss. Kate",female,36,2nd,S,England,27849,13,0,0,1
"Butler, Mr. Reginald Fenton",male,26,2nd,S,England,234686,13,0,0,0
"Butrus-Ka'wī, Mr. Tannūs",male,21,3rd,C,Lebanon,2648,7.0407,0,0,0
"Butt, Major. Archibald Willingham",male,46,1st,S,United States,113050,26.11,0,0,0
"Byles, Fr. Thomas Roussel Davids",male,42,2nd,S,England,244310,13,0,0,0
"Byström, Mrs. Karolina",female,40,2nd,S,United States,236852,13,0,0,1
"Cacic, Miss. Manda",female,21,3rd,S,Croatia (Modern),315087,8.1303,0,0,0
"Cacic, Miss. Marija",female,30,3rd,S,Croatia (Modern),315084,8.1303,0,0,0
"Cacic, Mr. Jego Grga",male,18,3rd,S,Croatia (Modern),315091,8.1303,0,0,0
"Cacic, Mr. Luka",male,38,3rd,S,Croatia (Modern),315089,8.1303,0,0,0
"Cairns, Mr. Alexander Milne",male,28,1st,S,Scotland,113798,31,0,0,0
"Calderhead, Mr. Edward Pennington",male,42,1st,S,United States,17476,26.0509,0,0,1
"Caldwell, Master. Alden Gates",male,0.8333333333,2nd,S,Siam,248738,29,0,2,1
"Caldwell, Mr. Albert Francis",male,26,2nd,S,Siam,248738,29,1,1,1
"Caldwell, Mrs. Sylvia Mae",female,28,2nd,S,United States,248738,29,1,1,1
"Calic, Mr. Jovo",male,17,3rd,S,Croatia (Modern),315093,8.1303,0,0,0
"Calic, Mr. Petar",male,17,3rd,S,Croatia (Modern),315086,8.1303,0,0,0
"Cameron, Miss. Clear Annie",female,35,2nd,S,England,13528,21,0,0,1
"Campbell, Mr. William Henry",male,21,2nd,B,Northern Ireland,239853,NA,0,0,0
"Canavan, Miss. Mary",female,22,3rd,Q,Ireland,364846,7.15,0,0,0
"Canavan, Mr. Patrick",male,21,3rd,Q,Ireland,364858,7.15,0,0,0
"Candee, Mrs. Helen Churchill",female,52,1st,C,United States,17606,27.0811,0,0,1
"Cann, Mr. Ernest",male,29,3rd,S,England,2152,8.01,0,0,0
"Caram, Mr. Joseph",male,28,3rd,C,Canada,2689,14.0902,1,0,0
"Caram, Mrs. Maria Elias",female,18,3rd,C,Lebanon,2689,14.0902,1,0,0
"Carbines, Mr. William",male,19,2nd,S,England,28424,13,0,0,0
"Cardeza, Mrs. Charlotte Wardle",female,58,1st,C,United States,17755,512.0607,0,1,1
"Cardeza, Mr. Thomas Drake Martinez",male,36,1st,C,United States,17755,512.0607,0,1,1
"Carlsson, Mr. August Sigfrid",male,28,3rd,S,Sweden,350042,7.1511,0,0,0
"Carlsson, Mr. Carl Robert",male,24,3rd,S,Sweden,350409,7.1701,0,0,0
"Carlsson, Mr. Frans Olof",male,33,1st,S,United States,695,5,0,0,0
"Carraú-Esteves, Mr. José Pedro",male,17,1st,S,Uruguay,113059,47.02,0,0,0
"Carrau, Mr. Francisco Mauro Severiano",male,27,1st,S,Uruguay,113059,47.02,0,0,0
"Carr, Miss. Jane",female,45,3rd,Q,Ireland,368364,7.15,0,0,0
"Carter, Fr. Ernest Courtenay",male,54,2nd,S,England,244252,26,1,0,0
"Carter, Master. William Thornton II",male,11,1st,S,United States,113760,120,1,2,1
"Carter, Miss. Lucile Polk",female,13,1st,S,United States,113760,120,1,2,1
"Carter, Mrs. Lilian",female,45,2nd,S,England,244252,26,1,0,0
"Carter, Mrs. Lucile",female,36,1st,S,United States,113760,120,1,2,1
"Carter, Mr. William Ernest",male,36,1st,S,United States,113760,120,1,2,1
"Carver, Mr. Alfred John",male,28,3rd,S,England,370160,7.05,0,0,0
"Case, Mr. Howard Brown",male,49,1st,S,United States,19924,26,0,0,0
"Cassebeer, Mrs. Eleanor Genevieve",female,36,1st,C,United States,17770,27.1405,0,0,1
"Cavendish, Mrs. Julia Florence",female,25,1st,S,United States,19877,78.17,1,0,1
"Cavendish, Mr. Tyrell William",male,36,1st,S,England,19877,78.17,1,0,0
"Celotti, Mr. Francesco",male,24,3rd,S,NA,343275,8.01,0,0,0
"Chaffee, Mr. Herbert Fuller",male,46,1st,S,United States,5734,61.0306,1,0,0
"Chaffee, Mrs. Carrie Constance",female,47,1st,S,United States,5734,61.0306,1,0,1
"Chambers, Mr. Norman Campbell",male,27,1st,S,United States,113806,53.02,1,0,1
"Chambers, Mrs. Bertha",female,32,1st,S,United States,113806,53.02,1,0,1
"Chapman, Mr. Charles Henry",male,52,2nd,S,United States,248731,13.1,0,0,0
"Chapman, Mr. John Henry",male,37,2nd,S,England,29037,26,1,0,0
"Chapman, Mrs. Sara Elizabeth",female,29,2nd,S,England,29037,26,1,0,0
"Charters, Mr. David",male,20,3rd,Q,Ireland,13032,7.1408,0,0,0
"Chaudanson, Miss. Victorine",female,36,1st,C,NA,17608,262.0706,0,0,1
"Cherry, Miss. Gladys",female,30,1st,S,England,110152,86.1,0,0,1
"Chevré, Mr. Paul Romaine Marie Léonce",male,45,1st,C,Belgium,17594,29.14,0,0,1
"Chibnall, Mrs. Edith Martha Bowerman",female,48,1st,S,England,113505,55,0,1,1
"Chip, Mr. Chang",male,32,3rd,S,NA,1601,56.0911,0,0,1
"Chisholm, Mr. Roderick Robert Crispin",male,43,1st,B,Scotland,112051,NA,0,0,0
"Christmann, Mr. Emil",male,29,3rd,S,England,343276,8.01,0,0,0
"Christy, Miss. Rachel Juli Cohen",female,25,2nd,S,England,237789,30,1,1,1
"Christy, Mrs. Alice Frances",female,52,2nd,S,England,237789,30,0,2,1
"Chronopoulos, Mr. Apostolos M.",male,26,3rd,C,NA,2680,14.0901,1,0,0
"Chronopoulos, Mr. Dimitrios M.",male,21,3rd,C,NA,2680,14.0901,1,0,0
"Clarke, Mr. Charles Valentine",male,29,2nd,S,England,2003,26,1,0,0
"Clarke, Mr. John Frederick Preston",male,28,2nd,S,England,250654,NA,NA,NA,0
"Clarke, Mrs. Ada Maria",female,28,2nd,S,England,2003,27,1,0,1
"Clark, Mrs. Virginia Estelle",female,26,1st,C,United States,13508,136.1507,1,0,1
"Clark, Mr. Walter Miller",male,27,1st,C,United States,13508,136.1507,1,0,0
"Cleaver, Miss. Alice Catherine",female,22,1st,S,England,113781,151.16,0,0,1
"Clifford, Mr. George Quincy",male,40,1st,S,United States,110465,52,0,0,0
"Coelho, Mr. Domingos Fernandeo",male,20,3rd,S,NA,3101307,7.01,0,0,0
"Cohen, Mr. Gurshon",male,18,3rd,S,England,3540,8.01,0,0,1
"Colbert, Mr. Patrick",male,24,3rd,Q,Ireland,371109,7.05,0,0,0
"Coleff, Mr. Satio",male,24,3rd,S,Bulgaria,349209,7.1711,0,0,0
"Coleridge, Mr. Reginald Charles",male,29,2nd,S,England,14263,10.1,0,0,0
"Collander, Mr. Erik Gustaf",male,27,2nd,S,Finland,248740,13,0,0,0
"Collett, Mr. Sidney Clarence Stuart",male,25,2nd,S,England,28034,10.1,0,0,1
"Colley, Mr. Edward Pomeroy",male,37,1st,S,Ireland,5727,25.1109,0,0,0
"Collyer, Miss. Marjorie Lottie",female,8,2nd,S,England,31921,26.05,0,2,1
"Collyer, Mr. Harvey",male,31,2nd,S,England,31921,26.05,1,1,0
"Collyer, Mrs. Charlotte Caroline",female,30,2nd,S,England,31921,26.05,1,1,1
"Coltcheff, Mr. Peju",male,36,3rd,S,Bulgaria,349210,7.1711,0,0,0
"Compton, Miss. Sara Rebecca",female,39,1st,C,United States,17756,83.0302,1,1,1
"Compton, Mr. Alexander Taylor jr",male,37,1st,C,United States,17756,83.0302,1,1,0
"Compton, Mrs. Mary Eliza",female,64,1st,C,United States,17756,83.0302,0,2,1
"Conlin, Mr. Thomas Henry",male,31,3rd,Q,United States,21332,7.1408,0,0,0
"Connaughton, Mr. Michael",male,40,3rd,Q,Ireland,335097,7.15,0,0,0
"Connolly, Miss. Catherine",female,23,3rd,Q,Ireland,370373,7.15,0,0,1
"Connolly, Miss. Kate",female,41,3rd,Q,Ireland,330972,7.1207,0,0,0
"Connors, Mr. Patrick",male,66,3rd,Q,Ireland,370369,7.15,0,0,0
"Cook, Mr. Jacob",male,43,3rd,S,NA,3536,8.01,0,0,0
"Cook, Mrs. Selena",female,22,2nd,S,England,14266,10.1,0,0,1
"Corbett, Mrs. Irene",female,30,2nd,S,United States,237249,13,0,0,0
"Corey, Mrs. Mary Emma",female,32,2nd,S,NA,13534,21,0,0,0
"Cor, Mr. Bartol",male,35,3rd,S,Croatia (Modern),349230,7.1711,0,0,0
"Cor, Mr. Ivan",male,27,3rd,S,Hungary,349229,7.1711,0,0,0
"Cor, Mr. Liudevit",male,19,3rd,S,Hungary,349231,7.1711,0,0,0
"Cornblatt, Mr. Harris",male,30,3rd,S,Poland,392090,8.01,0,0,0
"Cornell, Mrs. Malvina Helen",female,55,1st,S,United States,11770,25.141,2,0,1
"Corr, Miss. Ellen",female,16,3rd,Q,Ireland,367231,7.15,0,0,1
"Cotterill, Mr. Henry",male,21,2nd,S,England,29107,11.1,0,0,0
"Coutts, Master. Neville Leslie",male,3,3rd,S,England,37671,15.18,1,1,1
"Coutts, Master. William Loch",male,9,3rd,S,England,37671,15.18,1,1,1
"Coutts, Mrs. Winnie",female,36,3rd,S,England,37671,15.18,0,2,1
"Coxon, Mr. Daniel",male,58,3rd,S,England,364500,7.05,0,0,0
"Crafton, Mr. John Bertram",male,59,1st,S,United States,113791,26.11,0,0,0
"Crease, Mr. Ernest James",male,20,3rd,S,United States,3464,8.0302,0,0,0
"Cribb, Miss. Laura Mae",female,16,3rd,S,United States,371362,16.02,0,1,1
"Cribb, Mr. John Hatfield",male,43,3rd,S,Australia,371362,16.02,0,1,0
"Crosby, Captain. Edward Gifford",male,70,1st,S,United States,5735,71,1,1,0
"Crosby, Miss. Harriette Rebecca",female,39,1st,S,United States,112901,26.11,0,2,1
"Crosby, Mrs. Catherine Elizabeth",female,64,1st,S,United States,5735,71,1,1,1
"Culumovic, Mr. Jeso",male,17,3rd,S,Croatia (Modern),315090,8.1303,0,0,0
"Cumings, Mr. John Bradley",male,39,1st,C,United States,17599,71.0508,1,0,0
"Cumings, Mrs. Florence Briggs",female,35,1st,C,Peru,17599,71.0508,1,0,1
"Cunningham, Mr. Alfred Fleming",male,22,2nd,B,Northern Ireland,239853,NA,0,0,0
"Daher, Mr. Tannous",male,28,3rd,C,NA,2686,7.0407,0,0,0
"Dahlberg, Miss. Gerda Ulrika",female,22,3rd,S,Sweden,7552,10.1004,0,0,0
"Dahl, Mr. Charles Edward",male,45,3rd,S,NA,7598,8.01,0,0,1
"Dakic, Mr. Branko",male,19,3rd,S,NA,349228,10.0305,0,0,0
"Daly, Miss. Margaret Marcella",female,33,3rd,Q,Ireland,382650,6.19,0,0,1
"Daly, Mr. Eugene Patrick",male,29,3rd,Q,Ireland,382651,7.15,0,0,1
"Daly, Mr. Peter Dennis",male,51,1st,S,England,113055,26.11,0,0,1
"Danbom, Master. Gilbert Sigvard Emanuel",male,0.3333333333,3rd,S,Sweden,347080,14.08,0,2,0
"Danbom, Mr. Ernst Gilbert",male,34,3rd,S,Sweden,347080,14.08,1,1,0
"Danbom, Mrs. Anna Sigrid Maria",female,28,3rd,S,Sweden,347080,14.08,1,1,0
"Daniel, Mr. Robert Williams",male,27,1st,S,United States,113804,30.1,0,0,1
"Daniels, Miss. Sarah Rebecca",female,36,1st,S,England,113781,151.16,0,0,1
"Danoff, Mr. Yoto",male,27,3rd,S,NA,349219,7.1711,0,0,0
"Davidson, Mrs. Orian",female,27,1st,C,Canada,12750,52,1,2,1
"Davidson, Mr. Thornton",male,31,1st,C,Canada,12750,52,1,0,0
"Davies, Master. John Morgan jr",male,8,2nd,S,England,33112,36.15,1,1,1
"Davies, Mr. Alfred James",male,24,3rd,S,England,48871,24.03,2,0,0
"Davies, Mr. Charles Henry",male,19,2nd,S,England,14879,73.1,0,0,0
"Davies, Mr. Evan Lewis",male,22,3rd,S,Wales,23568,8.01,0,0,0
"Davies, Mr. John",male,22,3rd,S,England,48871,24.03,2,0,0
"Davies, Mr. Joseph",male,17,3rd,S,England,48873,8.01,2,0,0
"Davies, Mrs. Agnes",female,48,2nd,S,England,33112,36.15,0,2,1
"Davis, Miss. Mary Ann Charlotte",female,28,2nd,S,England,237668,13,0,0,1
"Davison, Mrs. Mary Elizabeth",female,34,3rd,S,England,386525,16.02,1,0,1
"Davison, Mr. Thomas Henry",male,32,3rd,S,England,386525,16.02,1,0,0
"Deacon, Mr. Percy William",male,18,2nd,S,England,14879,73.1,0,0,0
"Dean, Master. Bertram Vere",male,1,3rd,S,England,2315,20.1106,1,2,1
"Dean, Miss. Elizabeth Gladys 'Millvina'",female,0.1666666667,3rd,S,England,2315,20.1106,1,2,1
"Dean, Mr. Bertram Frank",male,25,3rd,S,England,2315,20.1106,1,2,0
"Dean, Mrs. Eva Georgetta",female,32,3rd,S,England,2315,20.1106,1,2,1
"Delalic, Mr. Redjo",male,25,3rd,S,Bosnia,349250,7.1711,0,0,0
"Del Carlo, Mrs. Argene",female,24,2nd,C,Italy,2167,27.1405,1,0,1
"Del Carlo, Mr. Sebastiano",male,29,2nd,C,Italy,2167,27.1405,1,0,0
"De Messemaeker, Mr. Guillaume Joseph",male,36,3rd,S,United States,345572,17.08,1,0,1
"De Messemaeker, Mrs. Anna",female,36,3rd,S,United States,345572,17.08,1,0,1
"De Mulder, Mr. Theodoor",male,30,3rd,S,Belgium,345774,9.1,0,0,1
"Denbuoy, Mr. Albert Joseph",male,25,2nd,S,Channel Islands,31029,31.1,0,0,0
"Denkoff, Mr. Mitto",male,30,3rd,S,NA,349225,7.1711,0,0,0
"Dennis, Mr. Samuel",male,22,3rd,S,England,21172,7.05,0,0,0
"Dennis, Mr. William",male,26,3rd,S,England,21175,7.05,0,0,0
"De Pelsmaeker, Mr. Alfons",male,16,3rd,S,Belgium,345778,9.1,0,0,0
"Devaney, Miss. Margaret Delia",female,19,3rd,Q,Ireland,330958,7.1707,0,0,1
"Dibden, Mr. William",male,18,2nd,S,England,14879,73.1,0,0,0
"Dick, Mr. Albert Adrian",male,31,1st,S,Canada,17474,57,1,0,1
"Dick, Mrs. Vera",female,17,1st,S,United States,17474,57,1,0,1
"Dika, Mr. Mirko",male,17,3rd,S,Croatia (Modern),349232,7.1711,0,0,0
"Dimic, Mr. Jovan",male,42,3rd,S,Hungary,315088,8.1303,0,0,0
"Dintcheff, Mr. Valtcho",male,43,3rd,S,NA,349226,7.1711,0,0,0
"Dodge, Dr. Washington",male,52,1st,S,United States,33638,81.1702,1,1,1
"Dodge, Master. Washington",male,4,1st,S,United States,33638,81.1702,0,2,1
"Dodge, Mrs. Ruth",female,34,1st,S,United States,33638,81.1702,1,1,1
"Doling, Miss. Elsie",female,18,2nd,S,England,231919,23,0,1,1
"Doling, Mrs. Ada Julia Elizabeth",female,34,2nd,S,England,231919,23,0,1,1
"Donohoe, Miss. Bridget",female,21,3rd,Q,Ireland,364856,7.15,0,0,0
"Dooly, Mr. Patrick",male,37,3rd,Q,Ireland,370376,7.15,0,0,0
"Dorking, Mr. Edward Arthur",male,18,3rd,S,England,10482,8.01,0,0,1
"Dougherty, Mr. William John",male,22,3rd,Q,Ireland,330877,8.0902,0,0,0
"Douglas, Mrs. Mahala",female,48,1st,C,United States,17761,106.0806,1,0,1
"Douglas, Mrs. Mary Hélène",female,27,1st,C,Canada,17558,247.1005,1,1,1
"Douglas, Mr. Walter Donald",male,50,1st,C,United States,17761,106.0806,1,0,0
"Douton, Mr. William Joseph",male,55,2nd,S,England,28403,26,0,0,0
"Dowdell, Miss. Elizabeth",female,31,3rd,S,United States,364516,12.0906,0,0,1
"Doyle, Miss. Elizabeth",female,28,3rd,Q,Ireland,368702,7.15,0,0,0
"Drazenovic, Mr. Jozef",male,33,3rd,C,Croatia (Modern),349241,7.1711,0,0,0
"Drew, Master. Marshall Brines",male,8,2nd,S,United States,28220,32.1,0,2,1
"Drew, Mr. James Vivian",male,42,2nd,S,England,28220,32.1,1,1,0
"Drew, Mrs. Maria Louisa Thorne",female,34,2nd,S,United States,28220,32.1,1,1,1
"Driscoll, Miss. Bridget",female,27,3rd,Q,Ireland,14311,7.15,0,0,1
"Dropkin, Miss. Jennie",female,24,3rd,S,England,392083,8.01,0,0,1
"Duff Gordon, Lucy Christiana, Lady",female,48,1st,C,England,17485,56.1807,1,0,1
"Duff Gordon, Sir. Cosmo Edmund",male,49,1st,C,England,11755,39.12,1,0,1
"Dulles, Mr. William Crothers",male,39,1st,C,United States,17580,29.14,0,0,0
"Duquemin, Mr. Joseph Pierre",male,24,3rd,S,Channel Islands,752,7.11,0,0,1
"Durán i Moné, Sra. Asuncion",female,27,2nd,C,Spain,2149,13.1702,1,0,1
