name,gender,age,class,embarked,country,ticketno,fare,sibsp,parch,survived
"Silvén, Miss. Lyyli Karoliina",female,17,2nd,S,Finland,250652,13,0,2,1
"Silverthorne, Mr. Spencer Victor",male,35,1st,S,United States,17475,26.0509,0,0,1
"Silvey, Mrs. Alice Gray",female,39,1st,C,United States,13507,55.18,1,0,1
"Silvey, Mr. William Baird",male,51,1st,C,United States,13507,55.18,1,0,0
"Simmons, Mr. John",male,40,3rd,S,England,392082,8.01,0,0,0
"Simonius-Blumer, Mr. Colonel (Oberst) Alfons",male,56,1st,S,Switzerland,13213,35.1,0,0,1
"Sincock, Miss. Maude",female,20,2nd,S,England,33112,36.15,0,0,1
"Sinkkonen, Miss. Anna",female,30,2nd,S,Finland,250648,13,0,0,1
"Sirayanian, Mr. Orsen",male,22,3rd,C,Turkey,2669,7.0407,0,0,0
"Sirota, Mr. Morris",male,20,3rd,S,England,392092,8.01,0,0,0
"Sivic, Mr. Husein",male,40,3rd,S,Bosnia,349251,7.1711,0,0,0
"Sivola, Mr. Antti Wilhelm",male,21,3rd,S,United States,3101280,7.1806,0,0,0
"Sjöblom, Miss. Anna Sofia",female,18,3rd,S,Finland,3101265,6.0911,0,0,1
"Sjöstedt, Mr. Ernst Adolf",male,59,2nd,S,Sweden,237442,13.1,0,0,0
"Skoog, Master. Harald",male,5,3rd,S,United States,347088,27.18,3,2,0
"Skoog, Master. Karl Thorsten",male,11,3rd,S,United States,347088,27.18,3,2,0
"Skoog, Miss. Mabel",female,9,3rd,S,United States,347088,27.18,3,2,0
"Skoog, Miss. Margit Elizabeth",female,2,3rd,S,United States,347088,27.18,3,2,0
"Skoog, Mrs. Anna Bernhardina",female,43,3rd,S,Sweden,347088,27.18,1,4,0
"Skoog, Mr. Wilhelm Johansson",male,40,3rd,S,Sweden,347088,27.18,1,4,0
"Slabenoff, Mr. Petco",male,42,3rd,S,NA,349214,7.1711,0,0,0
"Slayter, Miss. Hilda Mary",female,30,2nd,Q,Canada,234818,12.07,0,0,1
"Slemen, Mr. Richard James",male,35,2nd,S,England,28206,10.1,0,0,0
"Slocovski, Mr. Selman Francis",male,20,3rd,S,England,392086,8.01,0,0,0
"Sloper, Mr. William Thompson",male,28,1st,S,United States,113788,35.1,0,0,1
"Smart, Mr. John Montgomery",male,56,1st,S,England,113792,26.11,0,0,0
"Smiljanic, Mr. Mile",male,37,3rd,S,Croatia,315037,8.1303,0,0,0
"Smith, Miss. Marion Elsie",female,49,2nd,S,England,31418,13,0,0,1
"Smith, Mr. James Clinch",male,56,1st,C,France,17764,30.1311,0,0,0
"Smith, Mr. Lucian Philip",male,24,1st,C,United States,13695,60,1,0,0
"Smith, Mr. Richard William",male,57,1st,S,England,113056,26,0,0,0
"Smith, Mrs. Mary Eloise",female,18,1st,C,United States,13695,60,1,0,1
"Smyth, Miss. Julia",female,18,3rd,Q,Ireland,335432,7.1408,0,0,1
"Smyth, Mr. Thomas",male,27,3rd,Q,Ireland,384461,7.15,0,0,0
"Snyder, Mr. John Pillsbury",male,24,1st,S,United States,21228,82.0504,1,0,1
"Snyder, Mrs. Nelle",female,23,1st,S,United States,21228,82.0504,1,0,1
"Sobey, Mr. Samuel James Hayden",male,25,2nd,S,England,29178,13,0,0,0
"Søholt, Mr. Peter Andreas Lauritz Andersen",male,19,3rd,S,Norway,348124,7.13,0,0,0
"Somerton, Mr. Francis William",male,31,3rd,S,England,18509,8.01,0,0,0
"Spector, Mr. Woolf",male,23,3rd,S,England,3236,8.01,0,0,0
"Spedden, Master. Robert Douglas",male,6,1st,C,United States,16966,134.1,0,2,1
"Spedden, Mr. Frederic Oakley",male,45,1st,C,United States,16966,134.1,1,1,1
"Spedden, Mrs. Margaretta Corning",female,39,1st,C,United States,16966,134.1,1,1,1
"Spencer, Mrs. Marie Eugenie",female,48,1st,C,United States,17569,146.1005,1,0,1
"Spencer, Mr. William Augustus",male,57,1st,C,United States,17569,146.1005,1,0,0
"Spinner, Mr. Henry John",male,31,3rd,S,England,369943,8.01,0,0,0
"Stähelin-Maeglin, Dr. Max",male,32,1st,S,Switzerland,13214,30.1,0,0,1
"Staneff, Mr. Ivan",male,23,3rd,S,Bulgaria,349208,7.1711,0,0,0
"Stankovic, Mr. Ivan",male,33,3rd,C,Croatia,349239,8.1309,0,0,0
"Stanley, Miss. Amy Zillah Elsie",female,24,3rd,S,England,2314,7.11,0,0,1
"Stanley, Mr. Rowland Edwin",male,22,3rd,S,England,45380,8.01,0,0,0
"Stanton, Mr. Samuel Ward",male,42,2nd,C,United States,237734,15,0,0,0
"Stead, Mr. William Thomas",male,62,1st,S,England,113514,26.11,0,0,0
"Stengel, Mr. Charles Emil Henry",male,54,1st,C,United States,11778,55.081,1,0,1
"Stengel, Mrs. Annie May",female,43,1st,C,Ireland,11778,55.081,1,0,1
"Stephenson, Mrs. Martha",female,52,1st,C,United States,36947,78.0504,1,0,1
"Stewart, Mr. Albert Ankeny",male,64,1st,C,United States,17605,27.1405,0,0,0
"Stokes, Mr. Philip Joseph",male,24,2nd,S,England,13540,10.1,0,0,0
"Stone, Mrs. Martha Evelyn",female,61,1st,S,United States,113572,80,0,0,1
"Storey, Mr. Thomas",male,59,3rd,S,England,370160,NA,0,0,0
"Stoytcheff, Mr. Ilia",male,19,3rd,S,Bulgaria,349205,7.1711,0,0,0
"Strandberg, Miss. Ida Sofia",female,22,3rd,S,Finland,7553,9.1609,0,0,0
"Strandén, Mr. Juho Niilosson",male,30,3rd,S,Finland,3101288,7.1806,0,0,1
"Straus, Mr. Isidor",male,67,1st,S,United States,17483,221.1507,1,0,0
"Straus, Mrs. Rosalie Ida",female,63,1st,S,Germany,17483,221.1507,1,0,0
"Strilic, Mr. Ivan",male,27,3rd,S,Croatia,315083,8.1303,0,0,0
"Ström, Miss. Telma Matilda",female,2,3rd,S,United States,347054,10.0903,0,1,0
"Ström, Mrs. Elna Matilda",female,29,3rd,S,Sweden,347054,10.0903,1,1,0
"Sunderland, Mr. Victor Francis",male,20,3rd,S,England,392089,8.01,0,0,1
"Sundman, Mr. Johan Julian",male,44,3rd,S,Finland,3101269,7.1806,0,0,1
"Sutehall, Mr. Henry Jr",male,25,3rd,S,England,392076,7.01,0,0,0
"Sutton, Mr. Frederick",male,61,1st,S,England,36963,32.0605,0,0,0
"Svensson, Mr. Johan",male,74,3rd,S,Sweden,347060,7.1506,0,0,0
"Svensson, Mr. Johan Cervin",male,14,3rd,S,Sweden,7538,9.0406,0,0,1
"Svensson, Mr. Olof",male,24,3rd,S,Sweden,350035,7.1511,0,0,0
"Swane, Mr. George",male,19,2nd,S,England,248734,13,0,0,0
"Sweet, Mr. George Frederick",male,14,2nd,S,England,220845,65,0,0,0
"Swift, Mrs. Margaret Welles",female,46,1st,S,United States,17466,25.1807,0,0,1
"Tannūs, Master. As'ad",male,0.4166666667,3rd,C,Lebanon,2625,8.1004,0,1,1
"Tannūs, Mr. Bashīr",male,30,3rd,C,Lebanon,2621,6.0809,1,0,0
"Tannūs, Mrs. Thamīn",female,16,3rd,C,Lebanon,2625,8.1004,1,1,1
"Taussig, Miss. Ruth",female,18,1st,S,United States,110413,79.13,0,2,1
"Taussig, Mr. Emil",male,52,1st,S,United States,110413,79.13,1,1,0
"Taussig, Mrs. Tillie",female,39,1st,S,United States,110413,79.13,1,1,1
"Taylor, Mr. Elmer Zebley",male,48,1st,S,United States,19996,52,1,0,1
"Taylor, Mr. Percy Cornelius",male,40,2nd,S,England,250654,NA,NA,NA,0
"Taylor, Mrs. Juliet Cummins",female,49,1st,S,United States,19996,52,1,0,1
"Tenglin, Mr. Gunnar Isidor",male,25,3rd,S,Sweden,350033,7.1511,0,0,1
"Thayer, Mr. John Borland",male,49,1st,C,United States,17421,110.1708,1,1,0
"Thayer, Mr. John Borland jr",male,17,1st,C,United States,17421,110.1708,0,2,1
"Thayer, Mrs. Marian Longstreth",female,39,1st,C,United States,17421,110.1708,1,1,1
"Theobald, Mr. Thomas Leonard",male,34,3rd,S,England,363294,8.01,0,0,0
"Thomas/Tannous, Mr. John",male,34,3rd,C,NA,2681,6.0809,0,0,0
"Thomas/Tannous, Mr. Tannous",male,16,3rd,C,NA,2684,7.0406,0,0,0
"Thompson, Mr. Alexander Mellis",male,37,3rd,S,Scotland,32302,8.01,0,0,0
"Thorne, Miss. Gertrude Maybelle",female,38,1st,C,United States,17585,80,0,0,1
"Thorneycroft, Mr. Percival",male,37,3rd,S,England,376564,16.02,1,0,0
"Thorneycroft, Mrs. Florence Kate",female,33,3rd,S,England,376564,16.02,1,0,1
"Tikkanen, Mr. Juho",male,32,3rd,S,Finland,3101293,7.1806,0,0,0
"Tobin, Mr. Roger",male,20,3rd,Q,Ireland,383121,7.15,0,0,0
"Todoroff, Mr. Lalio",male,23,3rd,S,Bulgaria,349216,7.1711,0,0,0
"Tomlin, Mr. Ernest Portage",male,22,3rd,S,England,364499,8.01,0,0,0
"Toomey, Miss. Ellen Mary",female,48,2nd,S,Ireland,13531,10.1,0,0,1
"Törber, Mr. Ernst Wilhelm",male,41,3rd,S,England,364511,8.01,0,0,0
"Torfa, Mr. Assad",male,20,3rd,C,Lebanon,2673,7.0407,0,0,0
"Törnquist, Mr. William Henry",male,26,3rd,S,Sweden,NA,NA,0,0,1
"Totevski, Mr. Hristo Danchev",male,25,3rd,S,Bulgaria,349203,7.1711,0,0,0
"Troupiansky, Mr. Moses Aaron",male,23,2nd,S,England,233639,13,0,0,0
"Trout, Mrs. Jessie Laird",female,27,2nd,S,Scotland,240929,12.13,0,0,1
"Troutt, Miss. Edwina Celia",female,27,2nd,S,England,34218,10.1,0,0,1
"Tucker, Mr. Gilbert Milligan jr",male,31,1st,C,United States,2543,28.1009,0,0,1
"Tu'mah, Master. Jirjis Yūsuf",male,8,3rd,C,Lebanon,2650,15.0411,1,1,1
"Tu'mah, Miss. Mariyam",female,9,3rd,C,Lebanon,2650,15.0411,1,1,1
"Tu'mah, Mrs. Hinnah",female,27,3rd,C,Lebanon,2650,15.0411,0,2,1
"Turcin, Mr. Stjepan",male,36,3rd,S,Croatia,349247,7.1711,0,0,0
"Turja, Miss. Anna Sofia",female,18,3rd,S,Finland,4138,9.161,0,0,1
"Turkula, Mrs. Hedwig",female,63,3rd,S,Finland,4134,9.1109,0,0,1
"Turpin, Mrs. Dorothy Ann",female,26,2nd,S,England,11668,21,1,0,0
"Turpin, Mr. William John",male,29,2nd,S,England,11668,21,1,0,0
"Uruchurtu, Don. Manuel Ramirez",male,39,1st,C,Mexico,17601,27.1405,0,0,0
"van Billiard, Master. James William",male,10,3rd,S,England,851,14.1,1,1,0
"van Billiard, Master. Walter John",male,9,3rd,S,England,851,14.1,1,1,0
"van Billiard, Mr. Austin Blyler",male,35,3rd,S,England,851,14.1,0,2,0
"Van den Steen, Mr. Leo Peter",male,28,3rd,S,Belgium,345783,9.1,0,0,0
"Vandercruyssen, Mr. Victor",male,46,3rd,S,Belgium,345765,9,0,0,0
"Van der hoef, Mr. Wyckoff",male,61,1st,S,United States,111240,33.1,0,0,0
"Vanderplancke, Miss. Augusta Maria",female,18,3rd,S,Belgium,345764,18,2,0,0
"Vanderplancke, Mr. Julius",male,31,3rd,S,Belgium,345763,18,3,0,0
"Vanderplancke, Mr. Leo Edmondus",male,15,3rd,S,Belgium,345763,18,2,0,0
"Vanderplancke, Mrs. Emelie Maria",female,31,3rd,S,Belgium,345763,18,1,0,0
"Van de Velde, Mr. Johannes Josef",male,35,3rd,S,Belgium,345780,9.1,0,0,0
"Vandewalle, Mr. Nestor Cyriel",male,28,3rd,S,Belgium,345770,9.1,0,0,0
"Van Impe, Miss. Catharina",female,10,3rd,S,Belgium,345773,24.03,0,2,0
"Van Impe, Mr. Jean Baptiste",male,36,3rd,S,Belgium,345773,24.03,1,1,0
"Van Impe, Mrs. Rosalie Paula",female,30,3rd,S,Belgium,345773,24.03,1,1,0
"van Melckebeke, Mr. Philemon",male,23,3rd,S,Belgium,345777,9.1,0,0,0
"Vartanian, Mr. David",male,22,3rd,C,Turkey,2658,7.0406,0,0,1
"Veal, Mr. James",male,40,2nd,S,United States,28221,13,0,0,0
"Vendel, Mr. Olof Edvin",male,20,3rd,S,Sweden,350416,7.1701,0,0,0
"Veström, Miss. Hulda Amanda Adolfina",female,14,3rd,S,Sweden,350406,7.1701,0,0,0
"Vovk, Mr. Janko",male,21,3rd,S,Slovenia,349252,7.1711,0,0,0
"Waelens, Mr. Achille",male,22,3rd,S,Belgium,345767,9,0,0,0
"Walker, Mr. William Anderson",male,48,1st,S,United States,36967,34,0,0,0
"Wallcroft, Miss. Ellen 'Nellie'",female,36,2nd,S,England,13528,21,0,0,1
"Ward, Miss. Annie Moore",female,37,1st,C,NA,17755,512.0607,0,0,1
"Ware, Mr. Frederick",male,35,3rd,S,England,359309,8.01,0,0,0
"Ware, Mr. John James",male,47,2nd,S,England,31352,21,1,0,0
"Ware, Mrs. Florence Louise",female,32,2nd,S,England,31352,21,0,0,1
"Ware, Mr. William Jeffery",male,23,2nd,S,England,28666,10.1,1,0,0
"Warren, Mr. Charles William",male,31,3rd,S,England,49867,7.11,0,0,0
"Warren, Mr. Frank Manley",male,63,1st,C,United States,110813,75.05,1,0,0
"Warren, Mrs. Anna Sophia",female,60,1st,C,England,110813,75.05,1,0,1
"Watson, Mr. Ennis Hastings",male,19,2nd,B,Northern Ireland,239856,NA,0,0,0
"Watt, Miss. Robertha Josephine",female,12,2nd,S,Scotland,33595,15.15,0,0,1
"Watt, Mrs. Elizabeth",female,40,2nd,S,Scotland,33595,15.15,0,0,1
"Wazli, Mr. Yousif Ahmed",male,23,3rd,C,Lebanon,2647,7.0406,0,0,0
"Webber, Miss. Susan",female,37,2nd,S,England,27267,13,0,0,1
"Webber, Mr. James",male,66,3rd,S,England,3101316,8.01,0,0,0
"Weir, Colonel. John",male,59,1st,S,United States,113800,26.11,0,0,0
"Weisz, Mr. Léopold",male,37,2nd,S,Hungary,228414,26,1,0,0
"Weisz, Mrs. Mathilde Françoise",female,37,2nd,S,England,228414,26,1,0,1
"Wells, Master. Ralph Lester",male,2,2nd,S,England,29103,23,1,1,1
"Wells, Miss. Joan",female,4,2nd,S,England,29103,23,1,1,1
"Wells, Mrs. Addie Dart",female,29,2nd,S,England,29103,23,0,2,1
"Wennerström, Mr. August",male,27,3rd,S,Sweden,350043,7.1511,0,0,1
"West, Miss. Barbara Joyce",female,0.8333333333,2nd,S,England,34651,27.15,1,2,1
"West, Miss. Constance Mirium",female,4,2nd,S,England,34651,27.15,1,2,1
"West, Mr. Edwy Arthur",male,36,2nd,S,England,34651,27.15,1,2,0
"West, Mrs. Ada Mary",female,33,2nd,S,England,34651,27.15,1,2,1
"Wheadon, Mr. Edward Henry",male,65,2nd,S,England,24579,10.1,0,0,0
"Wheeler, Mr. Edwin Charles",male,26,2nd,S,England,2159,12.1706,0,0,0
"Whilems, Mr. Charles",male,31,2nd,S,England,244270,13,0,0,1
"White, Mr. Percival Wayland",male,54,1st,S,United States,35281,77.0509,0,1,0
"White, Mr. Richard Frasar",male,21,1st,S,United States,35281,77.0509,0,1,0
"White, Mrs. Ella",female,55,1st,C,NA,17760,135.1208,0,0,1
"Wick, Col. George Dennick",male,57,1st,S,United States,36928,164.1704,1,1,0
"Wick, Miss. Mary Natalie",female,31,1st,S,United States,36928,164.1704,0,2,1
"Wick, Mrs. Mary Peebles",female,45,1st,S,United States,36928,164.1704,1,1,1
"Widegren, Mr. Carl Peter",male,51,3rd,S,Sweden,347064,7.15,0,0,0
"Widener, Mr. George Dunton",male,50,1st,S,United States,113503,211.1,1,1,0
"Widener, Mr. Harry Elkins",male,27,1st,S,United States,113503,211.1,0,2,0
"Widener, Mrs. Eleanor",female,50,1st,S,United States,113503,211.1,1,1,1
"Wiklund, Mr. Jakob Alfred",male,18,3rd,S,Finland,3101267,6.0911,1,0,0
"Wiklund, Mr. Karl Johan",male,21,3rd,S,Finland,3101266,6.0911,1,0,0
"Wilkes, Mrs. Ellen",female,47,3rd,S,England,363272,7,1,0,1
"Wilkinson, Mrs. Elizabeth Anne",female,30,2nd,S,England,2926,26,1,0,1
"Willard, Miss. Constance",female,21,1st,S,United States,113795,26.11,0,0,1
"Willer, Mr. Aaron",male,37,3rd,C,NA,3410,8.1403,0,0,0
"Willey, Mr. Edward John",male,21,3rd,S,Wales,751,7.11,0,0,0
"Williams, Mr. Charles Duane",male,51,1st,C,Switzerland,17597,61.0707,0,1,0
"Williams, Mr. Charles Eugene",male,23,2nd,S,England,244373,13,0,0,1
"Williams, Mr. Fletcher Fellowes Lambert",male,43,1st,S,United States,113510,35,0,0,0
"Williams, Mr. Howard Hugh",male,28,3rd,S,England,2466,8.01,0,0,0
"Williams, Mr. Leslie",male,28,3rd,S,Wales,54636,16.02,0,0,0
"Williams, Mr. Richard Norris II",male,21,1st,C,Switzerland,17597,61.0707,0,1,1
"Wilson, Miss. Helen Alice",female,31,1st,C,NA,16966,134.1,0,0,1
"Windeløv, Mr. Einar",male,21,3rd,S,South Africa,3101317,7.05,0,0,0
"Wirz, Mr. Albert",male,27,3rd,S,Switzerland,315154,8.1303,0,0,0
"Wiseman, Mr. Philippe",male,54,3rd,S,England,34244,7.05,0,0,0
"Wittevrongel, Mr. Camilius Aloysius",male,36,3rd,S,Belgium,345771,9.1,0,0,0
"Woodward, Mr. John Wesley",male,32,2nd,S,England,250654,NA,NA,NA,0
"Woolner, Mr. Hugh",male,46,1st,S,England,19947,35.1,0,0,1
"Wright, Miss. Marion",female,26,2nd,S,England,220844,13.1,0,0,1
"Wright, Mr. George",male,62,1st,S,Canada,113807,26.11,0,0,0
"Yasbeck, Mr. Antoni",male,27,3rd,C,Lebanon,2659,14.0901,1,0,0
"Yazbeck, Mrs. Selini",female,15,3rd,C,Lebanon,2659,14.0901,1,0,1
"Young, Miss. Marie Grice",female,36,1st,C,United States,17760,135.1208,0,0,1
"Yousseff (Abi Saab), Mr. Gerios",male,26,3rd,C,Lebanon,2685,7.0406,0,0,0
"Youssiff (Sam'aan), Mr. Gerios",male,45,3rd,C,Lebanon,2628,7.0407,0,0,0
"Yūsuf, Mrs. Kātrīn",female,23,3rd,C,Lebanon,2668,22.0702,0,2,1
"Yvois, Miss. Henriette",female,24,2nd,S,France,248747,13,0,0,0
"Zakarian, Mr. Mapriededer",male,22,3rd,C,Turkey,2656,7.0406,0,0,0
"Zakarian, Mr. Ortin",male,27,3rd,C,Turkey,2670,7.0406,0,0,0
"Zenni, Mr. Philip",male,25,3rd,C,Lebanon,2620,7.0406,0,0,1
"Zimmermann, Mr. Leo",male,29,3rd,S,Germany,315082,7.1706,0,0,0
"Abbott, Mr. Ernest Owen",male,21,victualling crew,S,England,NA,NA,NA,NA,0
"Abrams, Mr. William Thomas",male,34,engineering crew,S,England,NA,NA,NA,NA,0
"Adams, Mr. Robert John",male,26,engineering crew,S,England,NA,NA,NA,NA,0
"Ahier, Mr. Percy Snowden",male,20,victualling crew,S,Channel Islands,NA,NA,NA,NA,0
"Akerman, Mr. Albert Edward",male,31,victualling crew,S,England,NA,NA,NA,NA,0
"Akerman, Mr. Joseph Francis",male,37,victualling crew,S,England,NA,NA,NA,NA,0
"Allaria, Sig. Battista Antonio",male,22,restaurant staff,S,England,NA,NA,NA,NA,0
"Allen, Mr. Ernest Frederick",male,24,engineering crew,S,England,NA,NA,NA,NA,1
"Allen, Mr. Frederick",male,17,victualling crew,S,England,NA,NA,NA,NA,0
"Allen, Mr. George",male,26,victualling crew,S,England,NA,NA,NA,NA,0
"Allen, Mr. Henry",male,30,engineering crew,S,England,NA,NA,NA,NA,0
"Allen, Mr. Robert Spencer",male,36,victualling crew,S,England,NA,NA,NA,NA,0
"Allsop, Mr. Alfred Samuel",male,36,engineering crew,B,England,NA,NA,NA,NA,0
"Allsop, Mr. Frank Richard",male,41,victualling crew,B,England,NA,NA,NA,NA,0
"Anderson, Mr. James",male,40,deck crew,S,England,NA,NA,NA,NA,1
"Anderson, Mr. Walter Yuill",male,48,victualling crew,S,England,NA,NA,NA,NA,0
"Andrews, Mr. Charles Edward",male,19,victualling crew,S,England,NA,NA,NA,NA,1
"Archer, Mr. Ernest Edward",male,35,deck crew,S,England,NA,NA,NA,NA,1
"Ashcroft, Mr. Austin Aloysius",male,26,victualling crew,S,England,NA,NA,NA,NA,0
"Ashe, Mr. Henry Wellesley",male,41,victualling crew,S,Ireland,NA,NA,NA,NA,0
"Aspeslagh, Mr. Georges",male,26,restaurant staff,S,England,NA,NA,NA,NA,0
"Avery, Mr. James Albert",male,21,engineering crew,S,England,NA,NA,NA,NA,1
"Ayling, Mr. Edwin George",male,23,victualling crew,S,England,NA,NA,NA,NA,0
"Back, Mr. Charles Frederick",male,37,victualling crew,B,England,NA,NA,NA,NA,0
"Baggott, Mr. Allen Marden",male,28,victualling crew,S,England,NA,NA,NA,NA,1
"Bagley, Mr. Edward Henry",male,33,victualling crew,S,England,NA,NA,NA,NA,0
"Bailey, Mr. George Francis",male,36,victualling crew,B,England,NA,NA,NA,NA,0
"Bailey, Mr. George Frank",male,46,engineering crew,S,Wales,NA,NA,NA,NA,0
"Bailey, Mr. Henry Joseph",male,46,deck crew,S,England,NA,NA,NA,NA,1
"Baines, Mr. Richard",male,24,engineering crew,S,England,NA,NA,NA,NA,0
"Ball, Mr. Percy",male,19,victualling crew,S,England,NA,NA,NA,NA,1
"Banfi, Sig. Ugo",male,24,restaurant staff,S,England,NA,NA,NA,NA,0
"Bannon, Mr. John Joseph",male,34,engineering crew,S,England,NA,NA,NA,NA,0
"Barker, Mr. Albert Vale",male,19,victualling crew,S,England,NA,NA,NA,NA,0
"Barker, Mr. Ernest Thomas",male,41,victualling crew,S,England,NA,NA,NA,NA,0
"Barker, Mr. Reginald Lomond",male,42,victualling crew,B,England,NA,NA,NA,NA,0
"Barlow, Mr. Charles",male,30,engineering crew,S,England,NA,NA,NA,NA,0
"Barlow, Mr. George",male,36,victualling crew,S,England,NA,NA,NA,NA,0
"Barnes, Mr. Charles",male,29,engineering crew,S,England,NA,NA,NA,NA,0
"Barnes, Mr. Frederick Charles",male,40,victualling crew,S,England,NA,NA,NA,NA,0
"Barnes, Mr. John",male,40,engineering crew,S,England,NA,NA,NA,NA,0
"Barratt, Mr. Arthur",male,16,victualling crew,S,England,NA,NA,NA,NA,0
"Barrett, Mr. Frederick",male,28,engineering crew,S,England,NA,NA,NA,NA,1
"Barrett, Mr. Frederick William",male,33,engineering crew,S,England,NA,NA,NA,NA,0
"Barringer, Mr. Arthur William",male,34,victualling crew,B,England,NA,NA,NA,NA,0
"Barrow, Mr. Charles Henry John Barrow",male,36,victualling crew,S,England,NA,NA,NA,NA,0
"Barrows, Mr. William",male,32,victualling crew,S,England,NA,NA,NA,NA,0
"Barton, Mr. Sidney John",male,26,victualling crew,S,England,NA,NA,NA,NA,0
"Basilico, Sig. Giovanni",male,27,restaurant staff,S,England,NA,NA,NA,NA,0
"Baxter, Mr. Harry Ross",male,53,victualling crew,S,England,NA,NA,NA,NA,0
"Baxter, Mr. Thomas Ferguson",male,55,victualling crew,S,Scotland,NA,NA,NA,NA,0
"Bazzi, Sig. Narciso",male,33,restaurant staff,S,England,NA,NA,NA,NA,0
"Beattie, Mr. Joseph",male,35,engineering crew,B,Northern Ireland,NA,NA,NA,NA,0
"Beauchamp, Mr. George William",male,24,engineering crew,S,England,NA,NA,NA,NA,1
"Bedford, Mr. William Barnett",male,31,victualling crew,S,England,NA,NA,NA,NA,0
"Beedem, Mr. George Arthur",male,35,victualling crew,S,England,NA,NA,NA,NA,0
"Beere, Mr. William",male,19,victualling crew,S,England,NA,NA,NA,NA,0
"Bell, Mr. Joseph",male,51,engineering crew,B,England,NA,NA,NA,NA,0
"Bendell, Mr. Frank",male,24,engineering crew,S,England,NA,NA,NA,NA,0
"Benham, Mr. Fred John",male,30,victualling crew,S,England,NA,NA,NA,NA,0
"Bennett, Mr. George Alfred",male,30,engineering crew,S,England,NA,NA,NA,NA,0
"Bennett, Mrs. Mabel",female,33,victualling crew,S,England,NA,NA,NA,NA,1
"Benville, Mr. Edward",male,47,engineering crew,S,England,NA,NA,NA,NA,0
"Bernardi, Sig. Battista",male,22,restaurant staff,S,England,NA,NA,NA,NA,0
"Bessant, Mr. Edward",male,31,victualling crew,S,England,NA,NA,NA,NA,0
"Bessant, Mr. William Edward Lowe",male,39,engineering crew,S,England,NA,NA,NA,NA,0
"Best, Mr. Edwin Alfred",male,40,victualling crew,B,England,NA,NA,NA,NA,0
"Beux, Mr. David",male,26,restaurant staff,S,England,NA,NA,NA,NA,0
"Bevis, Mr. Joseph Henry",male,22,engineering crew,S,England,NA,NA,NA,NA,0
"Biddlecombe, Mr. Reginald Charles",male,31,engineering crew,S,England,NA,NA,NA,NA,0
"Bietrix, Mr. George Baptiste",male,28,restaurant staff,S,England,NA,NA,NA,NA,0
"Biggs, Mr. Edward Charles",male,20,engineering crew,S,England,NA,NA,NA,NA,0
"Billows, Mr. James",male,20,engineering crew,S,England,NA,NA,NA,NA,0
"Binstead, Mr. Walter William",male,20,engineering crew,S,England,NA,NA,NA,NA,1
"Bishop, Mr. Walter Alexander",male,34,victualling crew,B,England,NA,NA,NA,NA,0
"Blackman, Mr. Albert Edward",male,23,engineering crew,S,England,NA,NA,NA,NA,0
"Black, Mr. Alexander",male,28,engineering crew,S,England,NA,NA,NA,NA,0
"Black, Mr. D.",male,41,engineering crew,S,England,NA,NA,NA,NA,0
"Blake, Mr. Percival Albert",male,23,engineering crew,S,England,NA,NA,NA,NA,1
"Blake, Mr. Seaton",male,26,engineering crew,B,England,NA,NA,NA,NA,0
"Blake, Mr. Thomas Henry",male,37,engineering crew,S,England,NA,NA,NA,NA,0
"Blaney, Mr. James",male,32,engineering crew,S,Northern Ireland,NA,NA,NA,NA,0
"Blann, Mr. Eustace Horatius",male,22,engineering crew,S,England,NA,NA,NA,NA,0
"Bliss, Mrs. Emma",female,45,victualling crew,S,Switzerland,NA,NA,NA,NA,1
"Blumet, Mr. Jean Baptiste",male,26,restaurant staff,S,England,NA,NA,NA,NA,0
"Bochatay, Mr. Alexis Joseph",male,30,victualling crew,S,England,NA,NA,NA,NA,0
"Bochet, Mr. Pierre Giuseppe",male,43,restaurant staff,S,England,NA,NA,NA,NA,0
"Bogie, Mr. Norman Leslie",male,59,victualling crew,S,Scotland,NA,NA,NA,NA,0
"Bolhuis, Mr. Hendrik",male,27,restaurant staff,S,England,NA,NA,NA,NA,0
"Bond, Mr. William John",male,40,victualling crew,B,England,NA,NA,NA,NA,0
"Boothby, Mr. Walter Thomas",male,38,victualling crew,S,England,NA,NA,NA,NA,0
"Boston, Mr. William John",male,33,victualling crew,B,England,NA,NA,NA,NA,0
"Bott, Mr. William Thomas",male,46,engineering crew,S,England,NA,NA,NA,NA,0
"Boughton, Mr. Bernard John",male,24,victualling crew,S,England,NA,NA,NA,NA,0
"Bowker, Miss. Ruth Harwood",female,31,restaurant staff,S,England,NA,NA,NA,NA,1
"Boxhall, Mr. Joseph Groves",male,28,deck crew,B,England,NA,NA,NA,NA,1
"Boyd, Mr. John",male,37,victualling crew,S,England,NA,NA,NA,NA,0
"Boyes, Mr. John Henry",male,36,victualling crew,B,England,NA,NA,NA,NA,0
"Bradley, Mr. Patrick Joseph",male,39,engineering crew,S,England,NA,NA,NA,NA,0
"Bradley, Mr. T.",male,29,deck crew,S,England,NA,NA,NA,NA,0
"Bradshaw, Mr. John Albert Perkin",male,43,victualling crew,S,England,NA,NA,NA,NA,0
"Brewer, Mr. Harry",male,30,engineering crew,S,England,NA,NA,NA,NA,0
"Brewster, Mr. George Henry",male,52,victualling crew,B,England,NA,NA,NA,NA,0
"Briant, Mr. Albert",male,34,engineering crew,S,England,NA,NA,NA,NA,0
"Brice, Mr. Walter Thomas",male,43,deck crew,S,England,NA,NA,NA,NA,1
"Bride, Mr. Harold Sydney",male,22,victualling crew,B,England,NA,NA,NA,NA,1
"Bright, Mr. Arthur John",male,42,deck crew,B,England,NA,NA,NA,NA,1
"Bristow, Mr. Harry",male,38,victualling crew,S,NA,NA,NA,NA,NA,0
"Bristow, Mr. Robert Charles",male,31,victualling crew,S,England,NA,NA,NA,NA,0
"Brookman, Mr. John Cress",male,28,victualling crew,S,England,NA,NA,NA,NA,0
"Brooks, Mr. J.",male,25,engineering crew,S,England,NA,NA,NA,NA,0
"Broome, Mr. Athol Frederick",male,31,victualling crew,S,England,NA,NA,NA,NA,0
"Broom, Mr. Herbert George",male,33,victualling crew,B,England,NA,NA,NA,NA,0
"Brown, Mr. Edward",male,34,victualling crew,B,Wales,NA,NA,NA,NA,1
"Brown, Mr. John",male,28,engineering crew,S,Wales,NA,NA,NA,NA,0
"Brown, Mr. Joseph James",male,25,engineering crew,S,England,NA,NA,NA,NA,0
"Brown, Mr. Walter James",male,41,victualling crew,B,England,NA,NA,NA,NA,0
"Buckley, Mr. H. E.",male,34,victualling crew,S,England,NA,NA,NA,NA,0
"Buley, Mr. Edward John",male,26,deck crew,S,England,NA,NA,NA,NA,1
"Bulley, Mr. Henry Ashburnham",male,22,victualling crew,S,England,NA,NA,NA,NA,0
"Bull, Mr. Walter Edward",male,37,victualling crew,S,England,NA,NA,NA,NA,0
"Bunnell, Mr. Wilfred James",male,21,victualling crew,B,England,NA,NA,NA,NA,0
"Burgess, Mr. Charles",male,18,victualling crew,S,England,NA,NA,NA,NA,1
"Burke, Mr. Richard Edward",male,30,victualling crew,B,England,NA,NA,NA,NA,0
"Burke, Mr. William",male,31,victualling crew,B,Ireland,NA,NA,NA,NA,1
"Burrage, Mr. Arthur Victor Edwards",male,20,victualling crew,S,England,NA,NA,NA,NA,1
"Burr, Mr. Ewart Sydenham",male,29,victualling crew,S,England,NA,NA,NA,NA,0
"Burroughs, Mr. Arthur Peckham",male,35,engineering crew,S,England,NA,NA,NA,NA,0
"Burton, Mr. Edward John",male,35,engineering crew,S,England,NA,NA,NA,NA,0
"Butterworth, Mr. John",male,23,victualling crew,S,England,NA,NA,NA,NA,0
"Butt, Mr. Robert Henry",male,22,victualling crew,S,England,NA,NA,NA,NA,0
"Butt, Mr. William John",male,31,engineering crew,S,England,NA,NA,NA,NA,0
"Byrne, Mr. James Edward",male,45,victualling crew,S,England,NA,NA,NA,NA,0
"Calderwood, Mr. Hugh",male,30,engineering crew,B,Northern Ireland,NA,NA,NA,NA,0
"Campbell, Mr. Donald S.",male,25,victualling crew,S,Australia,NA,NA,NA,NA,0
"Canner, Mr. John",male,40,engineering crew,S,England,NA,NA,NA,NA,0
"Carney, Mr. William",male,31,victualling crew,S,England,NA,NA,NA,NA,0
"Carr, Mr. Richard Stephen",male,27,engineering crew,S,England,NA,NA,NA,NA,0
"Carter (Ball), Mr. James (W.)",male,46,engineering crew,S,England,NA,NA,NA,NA,0
"Cartwright, Mr. James Edward",male,33,victualling crew,B,England,NA,NA,NA,NA,0
"Casali, Sig. Giulio",male,32,restaurant staff,S,Italy,NA,NA,NA,NA,0
