name,gender,age,class,embarked,country,ticketno,fare,sibsp,parch,survived
"Casey, Mr. Thomas",male,44,engineering crew,S,England,NA,NA,NA,NA,0
"Casswill, Mr. Charles",male,34,victualling crew,S,England,NA,NA,NA,NA,0
"Castleman, Mr. Edward",male,37,engineering crew,S,England,NA,NA,NA,NA,0
"Caton, Miss. Annie",female,33,victualling crew,S,England,NA,NA,NA,NA,1
"Caunt, Mr. William Ewart",male,28,victualling crew,S,England,NA,NA,NA,NA,0
"Cavell, Mr. George Henry",male,22,engineering crew,S,England,NA,NA,NA,NA,1
"Cave, Mr. Herbert",male,39,victualling crew,B,England,NA,NA,NA,NA,0
"Cecil, Mr. Charles Thomas",male,21,victualling crew,S,England,NA,NA,NA,NA,0
"Chaboisson, Mr. Adrien Finnin",male,25,restaurant staff,S,England,NA,NA,NA,NA,0
"Chapman, Mr. Joseph Charles",male,32,victualling crew,S,England,NA,NA,NA,NA,1
"Charman, Mr. John James",male,25,victualling crew,S,England,NA,NA,NA,NA,0
"Cherrett, Mr. William Victor",male,25,engineering crew,S,England,NA,NA,NA,NA,0
"Cheverton, Mr. William Frederick",male,28,victualling crew,B,England,NA,NA,NA,NA,0
"Chisnall, Mr. George Alexander",male,37,engineering crew,B,England,NA,NA,NA,NA,0
"Chitty, Mr. Archibald George",male,29,victualling crew,S,England,NA,NA,NA,NA,0
"Chitty, Mr. George Henry",male,50,victualling crew,S,England,NA,NA,NA,NA,0
"Chorley, Mr. John Henry",male,25,engineering crew,S,England,NA,NA,NA,NA,0
"Christmas, Mr. Herbert Harry",male,34,victualling crew,S,England,NA,NA,NA,NA,0
"Clark, Mr. William",male,40,engineering crew,S,Ireland,NA,NA,NA,NA,1
"Clench, Mr. Frederick Charles",male,33,deck crew,S,England,NA,NA,NA,NA,1
"Clench, Mr. George James",male,31,deck crew,S,England,NA,NA,NA,NA,0
"Coe, Mr. Harry",male,22,engineering crew,S,England,NA,NA,NA,NA,0
"Coleman, Mr. Albert Edward",male,29,victualling crew,S,England,NA,NA,NA,NA,0
"Coleman, Mr. John",male,58,engineering crew,B,Ireland,NA,NA,NA,NA,0
"Colgan, Mr. E. Joseph",male,33,victualling crew,S,England,NA,NA,NA,NA,1
"Collins, Mr. John",male,17,victualling crew,S,Northern Ireland,NA,NA,NA,NA,1
"Collins, Mr. John",male,38,engineering crew,S,England,NA,NA,NA,NA,1
"Combes, Mr. George",male,34,engineering crew,S,England,NA,NA,NA,NA,1
"Conway, Mr. Percy Walter",male,25,victualling crew,B,England,NA,NA,NA,NA,0
"Cook, Mr. Gilbert William",male,32,victualling crew,S,England,NA,NA,NA,NA,0
"Coombs, Mr. Charles Augustus",male,45,victualling crew,S,England,NA,NA,NA,NA,0
"Cooper, Mr. Harry",male,26,engineering crew,S,England,NA,NA,NA,NA,0
"Cooper, Mr. James Edward",male,26,engineering crew,S,England,NA,NA,NA,NA,0
"Copperthwaite, Mr. Albert Harry",male,28,engineering crew,S,England,NA,NA,NA,NA,0
"Corben, Mr. Ernest Theodore",male,27,victualling crew,S,England,NA,NA,NA,NA,0
"Corcoran, Mr. Dennis",male,33,engineering crew,S,England,NA,NA,NA,NA,0
"Cornaire, Mr. Marcel Raymond André",male,19,restaurant staff,S,England,NA,NA,NA,NA,0
"Cotton, Mr. Alfred",male,36,engineering crew,S,England,NA,NA,NA,NA,0
"Couch, Mr. Frank",male,28,deck crew,S,England,NA,NA,NA,NA,0
"Couch, Mr. Joseph Henry",male,49,engineering crew,S,England,NA,NA,NA,NA,0
"Couper, Mr. Robert Frederick William",male,30,engineering crew,S,England,NA,NA,NA,NA,1
"Coutin, Mr. Auguste Louis",male,28,restaurant staff,S,France,NA,NA,NA,NA,0
"Cox, Mr. William Denton",male,30,victualling crew,S,England,NA,NA,NA,NA,0
"Coy, Mr. Francis Ernest George",male,27,engineering crew,B,England,NA,NA,NA,NA,0
"Crabb, Mr. Henry James",male,23,engineering crew,S,England,NA,NA,NA,NA,0
"Crafter, Mr. Frederick Horace",male,20,victualling crew,S,England,NA,NA,NA,NA,1
"Crawford, Mr. Alfred George",male,43,victualling crew,B,England,NA,NA,NA,NA,1
"Creese, Mr. Henry Philip",male,45,engineering crew,B,England,NA,NA,NA,NA,0
"Crimmins, Mr. James",male,21,engineering crew,S,England,NA,NA,NA,NA,1
"Crispin, Mr. William",male,33,victualling crew,S,England,NA,NA,NA,NA,0
"Crisp, Mr. Albert Hector",male,39,victualling crew,B,England,NA,NA,NA,NA,0
"Crosbie, Mr. John Borthwick",male,45,victualling crew,S,England,NA,NA,NA,NA,0
"Cross, Mr. William Alfred",male,44,engineering crew,S,England,NA,NA,NA,NA,0
"Crovella, Sig. Luigi",male,17,restaurant staff,S,England,NA,NA,NA,NA,0
"Crowe, Mr. George Frederick",male,30,victualling crew,S,England,NA,NA,NA,NA,1
"Crumplin, Mr. Charles George Chandler",male,35,victualling crew,B,England,NA,NA,NA,NA,0
"Cullen, Mr. Charles James",male,49,victualling crew,B,England,NA,NA,NA,NA,1
"Cunningham, Mr. Andrew Orr",male,38,victualling crew,B,Scotland,NA,NA,NA,NA,1
"Cunningham, Mr. Bernard",male,35,engineering crew,S,England,NA,NA,NA,NA,0
"Curtis, Mr. Arthur",male,26,engineering crew,S,England,NA,NA,NA,NA,0
"Daniels, Mr. Sidney Edward",male,18,victualling crew,S,England,NA,NA,NA,NA,1
"Dashwood, Mr. William George",male,18,victualling crew,S,England,NA,NA,NA,NA,0
"Davies, Mr. Gordon Raleigh",male,32,victualling crew,B,England,NA,NA,NA,NA,0
"Davies, Mr. Robert J.",male,26,victualling crew,B,Wales,NA,NA,NA,NA,0
"Davies, Mr. Thomas",male,33,engineering crew,S,England,NA,NA,NA,NA,0
"Davis, Mr. John",male,29,victualling crew,B,England,NA,NA,NA,NA,0
"Davis, Mr. Stephen James",male,39,deck crew,S,England,NA,NA,NA,NA,0
"Dawson, Mr. Joseph",male,23,engineering crew,S,England,NA,NA,NA,NA,0
"Dean, Mr. George H.",male,19,victualling crew,S,England,NA,NA,NA,NA,0
"Debreucq, Mr. Maurice Emile Victor",male,18,restaurant staff,S,England,NA,NA,NA,NA,0
"Deeble, Mr. Alfred Arnold",male,35,victualling crew,B,England,NA,NA,NA,NA,0
"De Marsico, Sig. Govanni",male,20,restaurant staff,S,England,NA,NA,NA,NA,0
"Derrett, Mr. Arthur Henry",male,29,victualling crew,B,England,NA,NA,NA,NA,0
"Deslandes, Mr. Percival Stainer",male,38,victualling crew,S,England,NA,NA,NA,NA,0
"Desvernine, Mr. Louis Gabriel",male,20,restaurant staff,S,England,NA,NA,NA,NA,0
"Diaper, Mr. John Joseph",male,27,engineering crew,S,England,NA,NA,NA,NA,1
"Dickson, Mr. William",male,37,engineering crew,S,England,NA,NA,NA,NA,0
"Dilley, Mr. John",male,30,engineering crew,S,England,NA,NA,NA,NA,1
"Dillon, Mr. Thomas Patrick",male,34,engineering crew,S,England,NA,NA,NA,NA,1
"Dinenage, Mr. James Richard",male,49,victualling crew,S,England,NA,NA,NA,NA,0
"Dodd, Mr. Edward Charles",male,39,engineering crew,B,England,NA,NA,NA,NA,0
"Dodd, Mr. George Charles",male,44,victualling crew,B,England,NA,NA,NA,NA,0
"Dodds, Mr. Henry Watson",male,27,engineering crew,S,Guyana,NA,NA,NA,NA,0
"Doel, Mr. Frederick",male,22,engineering crew,S,England,NA,NA,NA,NA,1
"Dolby, Mr. Joseph",male,39,victualling crew,B,England,NA,NA,NA,NA,0
"Donati, Sig. Italo Francesco",male,17,restaurant staff,S,Italy,NA,NA,NA,NA,0
"Donoghue, Mr. Frank (?Thomas)",male,35,victualling crew,B,England,NA,NA,NA,NA,0
"Dore, Mr. Albert James",male,23,engineering crew,S,England,NA,NA,NA,NA,1
"Dornier, Mr. Louis Auguste",male,20,restaurant staff,S,England,NA,NA,NA,NA,0
"Doughty, Mr. Walter Thomas",male,22,victualling crew,S,England,NA,NA,NA,NA,0
"Doyle, Mr. Laurence",male,27,engineering crew,S,England,NA,NA,NA,NA,0
"Duffy, Mr. William Luke",male,36,engineering crew,B,Ireland,NA,NA,NA,NA,0
"Dunford, Mr. William",male,48,victualling crew,S,England,NA,NA,NA,NA,0
"Durnil, Mr. James",male,38,engineering crew,S,England,NA,NA,NA,NA,0
"Dyer, Mr. Henry Ryland",male,24,engineering crew,B,India,NA,NA,NA,NA,0
"Dyer, Mr. William Henry",male,33,victualling crew,S,England,NA,NA,NA,NA,0
"Dymond, Mr. Frank",male,41,engineering crew,S,England,NA,NA,NA,NA,1
"Eagle, Mr. Alfred James",male,22,engineering crew,S,England,NA,NA,NA,NA,0
"Eastman, Mr. Charles",male,44,engineering crew,S,England,NA,NA,NA,NA,0
"Edbrooke, Mr. Francis Samuel Jacob",male,23,victualling crew,S,England,NA,NA,NA,NA,0
"Ede, Mr. George Bulkeley",male,23,victualling crew,S,England,NA,NA,NA,NA,0
"Edge, Mr. Frederick William",male,39,victualling crew,S,England,NA,NA,NA,NA,0
"Edwards, Mr. Charles Essex",male,39,victualling crew,S,Wales,NA,NA,NA,NA,0
"Egg, Mr. William Henry",male,48,victualling crew,S,England,NA,NA,NA,NA,0
"Elliott, Mr. Everett Edward",male,23,engineering crew,S,England,NA,NA,NA,NA,0
"Ellis, Mr. John Bertie",male,29,victualling crew,S,England,NA,NA,NA,NA,1
"Ennis, Mr. Walter",male,34,victualling crew,S,England,NA,NA,NA,NA,0
"Ervine, Mr. Albert George",male,18,engineering crew,B,Northern Ireland,NA,NA,NA,NA,0
"Etches, Mr. Henry Samuel",male,43,victualling crew,B,England,NA,NA,NA,NA,1
"Evans, Mr. Alfred Frank",male,25,deck crew,S,England,NA,NA,NA,NA,1
"Evans, Mr. Frank Oliver",male,27,deck crew,S,England,NA,NA,NA,NA,1
"Evans, Mr. George Richard",male,27,victualling crew,B,England,NA,NA,NA,NA,0
"Evans, Mr. William Thomas",male,33,engineering crew,S,England,NA,NA,NA,NA,0
"Fairall, Mr. Henry Charles",male,38,victualling crew,B,England,NA,NA,NA,NA,0
"Farenden, Mr. Ernest John",male,22,victualling crew,B,England,NA,NA,NA,NA,0
"Farquharson, Mr. William Edward",male,39,engineering crew,B,England,NA,NA,NA,NA,0
"Faulkner, Mr. William Stephen",male,37,victualling crew,B,England,NA,NA,NA,NA,1
"Fay, Mr. Thomas Joseph",male,30,engineering crew,S,England,NA,NA,NA,NA,0
"Fellowes, Mr. Alfred James",male,29,victualling crew,B,England,NA,NA,NA,NA,0
"Feltham, Mr. George William",male,42,victualling crew,S,England,NA,NA,NA,NA,0
"Ferrary, Mr. Antonio",male,33,engineering crew,S,England,NA,NA,NA,NA,0
"Ferris, Mr. William",male,39,engineering crew,S,England,NA,NA,NA,NA,0
"Fey, Sig. Carlo",male,30,restaurant staff,S,England,NA,NA,NA,NA,0
"Finch, Mr. Henry Herman",male,19,victualling crew,S,England,NA,NA,NA,NA,0
"Fioravante, Sig. Giuseppe Bertoldo",male,23,restaurant staff,S,England,NA,NA,NA,NA,0
"Fitzpatrick, Mr. Cecil William",male,21,engineering crew,S,England,NA,NA,NA,NA,1
"Fitzpatrick, Mr. Hugh Joseph",male,29,engineering crew,B,England,NA,NA,NA,NA,0
"Flarty, Mr. Edward",male,52,engineering crew,S,England,NA,NA,NA,NA,1
"Fleet, Mr. Frederick",male,24,deck crew,B,England,NA,NA,NA,NA,1
"Fletcher, Mr. Percy William",male,26,victualling crew,B,England,NA,NA,NA,NA,0
"Foley, Mr. John",male,46,deck crew,B,Ireland,NA,NA,NA,NA,1
"Foley, Mr. Wilfred Cyril",male,22,victualling crew,S,Wales,NA,NA,NA,NA,1
"Ford, Mr. Ernest",male,33,victualling crew,S,England,NA,NA,NA,NA,0
"Ford, Mr. Francis",male,44,victualling crew,S,England,NA,NA,NA,NA,0
"Ford, Mr. H.",male,22,engineering crew,S,England,NA,NA,NA,NA,0
"Ford, Mr. Thomas",male,33,engineering crew,S,England,NA,NA,NA,NA,0
"Forward, Mr. James",male,27,deck crew,S,England,NA,NA,NA,NA,1
"Foster, Mr. Alfred Charles",male,37,engineering crew,B,England,NA,NA,NA,NA,0
"Fox, Mr. William Thomas",male,27,victualling crew,S,England,NA,NA,NA,NA,0
"Franklin, Mr. Alan Vincent",male,28,victualling crew,S,England,NA,NA,NA,NA,0
"Fraser, Mr. J.",male,30,engineering crew,S,England,NA,NA,NA,NA,0
"Fraser, Mr. James",male,30,engineering crew,B,Scotland,NA,NA,NA,NA,0
"Fredericks, Mr. Walter Francis",male,21,engineering crew,S,England,NA,NA,NA,NA,1
"Freeman, Mr. Ernest Edward Samuel",male,45,victualling crew,B,England,NA,NA,NA,NA,0
"Fryer, Mr. Albert Ernest",male,29,engineering crew,S,England,NA,NA,NA,NA,1
"Gatti, Sig. Gaspare Antonio Pietro",male,37,restaurant staff,S,England,NA,NA,NA,NA,0
"Geddes, Mr. Richard Charles",male,32,victualling crew,S,England,NA,NA,NA,NA,0
"Geer, Mr. Alfred Emest",male,26,engineering crew,S,England,NA,NA,NA,NA,0
"Gibbons, Mr. Jacob William",male,36,victualling crew,S,England,NA,NA,NA,NA,1
"Gilardino, Sig. Vincenzo Pio",male,31,restaurant staff,S,England,NA,NA,NA,NA,0
"Giles, Mr. John Robert",male,32,victualling crew,S,England,NA,NA,NA,NA,0
"Gill, Mr. Joseph Stanley",male,38,victualling crew,B,England,NA,NA,NA,NA,0
"Gill, Mr. Patrick",male,38,victualling crew,S,England,NA,NA,NA,NA,0
"Godley, Mr. George Auguste",male,61,engineering crew,S,England,NA,NA,NA,NA,1
"Godwin, Mr. Frederick Charles",male,36,engineering crew,S,England,NA,NA,NA,NA,0
"Golder, Mr. M. W.",male,32,engineering crew,S,England,NA,NA,NA,NA,0
"Gold, Mrs. Jane Kate Coulson",female,45,victualling crew,S,England,NA,NA,NA,NA,1
"Gollop, Mr. F.",male,28,victualling crew,S,England,NA,NA,NA,NA,0
"Gordon, Mr. J.",male,29,engineering crew,S,England,NA,NA,NA,NA,0
"Goree, Mr. Frank",male,41,engineering crew,S,England,NA,NA,NA,NA,0
"Goshawk, Mr. Alfred James",male,40,victualling crew,B,England,NA,NA,NA,NA,0
"Gosling, Mr. Bertram James",male,22,engineering crew,S,England,NA,NA,NA,NA,0
"Gosling, Mr. S.",male,26,engineering crew,S,England,NA,NA,NA,NA,0
"Gradidge, Mr. Ernest Edward",male,22,engineering crew,S,England,NA,NA,NA,NA,0
"Graham, Mr. Thomas Gibson",male,28,engineering crew,B,Northern Ireland,NA,NA,NA,NA,1
"Gregory, Mr. David",male,43,engineering crew,S,England,NA,NA,NA,NA,0
"Gregson, Miss. Mary",female,45,victualling crew,S,England,NA,NA,NA,NA,1
"Grosclaude, Mr. Gérald",male,24,restaurant staff,S,England,NA,NA,NA,NA,0
"Gumery, Mr. George",male,24,engineering crew,S,England,NA,NA,NA,NA,0
"Gunn, Mr. Joseph Alfred",male,30,victualling crew,S,England,NA,NA,NA,NA,0
"Guy, Mr. Elgar John",male,29,victualling crew,S,England,NA,NA,NA,NA,1
"Gwinn, Mr. William Logan",male,37,victualling crew,S,United States,NA,NA,NA,NA,0
"Haggan, Mr. John",male,35,engineering crew,B,Northern Ireland,NA,NA,NA,NA,1
"Haines, Mr. Albert",male,31,deck crew,B,England,NA,NA,NA,NA,1
"Halford, Mr. Walter Stamford",male,22,victualling crew,S,England,NA,NA,NA,NA,1
"Hallett, Mr. George Alexander",male,23,engineering crew,S,England,NA,NA,NA,NA,0
"Hall, Mr. Frank Alfred James",male,41,victualling crew,S,England,NA,NA,NA,NA,0
"Hall, Mr. J.",male,32,engineering crew,S,England,NA,NA,NA,NA,0
"Hamblyn, Mr. Ernest William",male,47,victualling crew,S,England,NA,NA,NA,NA,0
"Hamilton, Mr. Ernest",male,25,victualling crew,B,England,NA,NA,NA,NA,0
"Hands, Mr. Bernard",male,54,engineering crew,S,Ireland,NA,NA,NA,NA,0
"Hannam, Mr. George",male,30,engineering crew,S,England,NA,NA,NA,NA,0
"Harder, Mr. William",male,39,deck crew,S,England,NA,NA,NA,NA,1
"Harding, Mr. Alfred John",male,21,victualling crew,S,England,NA,NA,NA,NA,0
"Hardwick, Mr. Reginald",male,21,victualling crew,S,England,NA,NA,NA,NA,1
"Hardy, Mr. John",male,40,victualling crew,B,England,NA,NA,NA,NA,1
"Harris, Mr. Amos",male,24,engineering crew,S,England,NA,NA,NA,NA,0
"Harris, Mr. Charles William",male,19,victualling crew,S,England,NA,NA,NA,NA,0
"Harris, Mr. Clifford Henry",male,17,victualling crew,S,England,NA,NA,NA,NA,0
"Harris, Mr. Edward John",male,29,engineering crew,S,England,NA,NA,NA,NA,0
"Harris, Mr. Edward Matthew",male,17,victualling crew,S,England,NA,NA,NA,NA,0
"Harris, Mr. Frederick",male,39,engineering crew,S,England,NA,NA,NA,NA,1
"Harrison, Mr. Aragõa Drummond",male,40,victualling crew,S,England,NA,NA,NA,NA,1
"Harrison, Mr. Norman E.",male,38,engineering crew,B,England,NA,NA,NA,NA,0
"Hart, Mr. James",male,54,engineering crew,S,England,NA,NA,NA,NA,0
"Hart, Mr. John Edward",male,32,victualling crew,S,England,NA,NA,NA,NA,1
"Hartnell, Mr. Fred",male,21,victualling crew,S,England,NA,NA,NA,NA,1
"Harvey, Mr. Herbert Gifford",male,34,engineering crew,B,Northern Ireland,NA,NA,NA,NA,0
"Hatch, Mr. Hugh",male,23,victualling crew,S,England,NA,NA,NA,NA,0
"Hawkesworth, Mr. James",male,52,victualling crew,S,England,NA,NA,NA,NA,0
"Hawkesworth, Mr. William Walter",male,43,victualling crew,S,England,NA,NA,NA,NA,0
"Hayter, Mr. Arthur",male,45,victualling crew,B,England,NA,NA,NA,NA,0
"Head, Mr. Alfred",male,24,engineering crew,S,England,NA,NA,NA,NA,0
"Hebb, Mr. William Albert",male,22,engineering crew,S,England,NA,NA,NA,NA,1
"Heinen, Mr. Joseph Dominichus",male,30,victualling crew,S,England,NA,NA,NA,NA,0
"Hemming, Mr. Samuel Ernest",male,43,deck crew,B,England,NA,NA,NA,NA,1
"Hendrickson, Mr. Charles Osker",male,28,engineering crew,S,England,NA,NA,NA,NA,1
"Hendy, Mr. Edward Martin",male,40,victualling crew,B,England,NA,NA,NA,NA,0
"Hensford, Mr. Herbert George Ernest",male,26,victualling crew,S,England,NA,NA,NA,NA,0
"Hesketh, Mr. John Henry",male,33,engineering crew,B,England,NA,NA,NA,NA,0
"Heslin, Mr. James",male,45,engineering crew,S,England,NA,NA,NA,NA,0
"Hewitt, Mr. Thomas",male,37,victualling crew,B,England,NA,NA,NA,NA,0
"Hichens, Mr. Robert",male,29,deck crew,S,England,NA,NA,NA,NA,1
"Hill, Mr. H. P.",male,36,victualling crew,S,England,NA,NA,NA,NA,0
"Hill, Mr. James",male,25,engineering crew,S,England,NA,NA,NA,NA,0
"Hill, Mr. James Colston",male,43,victualling crew,B,England,NA,NA,NA,NA,0
"Hinckley, Mr. George Herbert",male,40,victualling crew,S,England,NA,NA,NA,NA,0
"Hine, Mr. William Edward",male,36,victualling crew,S,England,NA,NA,NA,NA,0
"Hinton, Mr. Stephen William",male,31,engineering crew,S,England,NA,NA,NA,NA,0
"Hiscock, Mr. Sydney George",male,25,victualling crew,S,England,NA,NA,NA,NA,0
"Hoare, Mr. Leonard James",male,19,victualling crew,B,England,NA,NA,NA,NA,0
"Hodge, Mr. Charley",male,29,engineering crew,B,England,NA,NA,NA,NA,0
"Hodges, Mr. W.",male,26,engineering crew,S,England,NA,NA,NA,NA,0
"Hodgkinson, Mr. Leonard",male,46,engineering crew,B,England,NA,NA,NA,NA,0
"Hogg, Mr. Charles William",male,43,victualling crew,S,England,NA,NA,NA,NA,0
"Hogg, Mr. George Alfred",male,29,deck crew,B,England,NA,NA,NA,NA,1
"Hogue, Mr. E.",male,22,victualling crew,S,England,NA,NA,NA,NA,0
"Holland, Mr. Thomas",male,28,victualling crew,B,England,NA,NA,NA,NA,0
"Holloway, Mr. Sidney",male,24,victualling crew,S,England,NA,NA,NA,NA,0
"Holman, Mr. Harry",male,29,deck crew,B,England,NA,NA,NA,NA,0
"Hopgood, Mr. Roland John C.",male,29,engineering crew,S,England,NA,NA,NA,NA,0
"Hopkins, Mr. Frederick William",male,15,victualling crew,S,England,NA,NA,NA,NA,0
"Hopkins, Mr. Robert John",male,40,deck crew,S,England,NA,NA,NA,NA,1
"Horswill, Mr. Albert Edward James",male,33,deck crew,S,England,NA,NA,NA,NA,1
"Hosgood, Mr. Richard William",male,23,engineering crew,S,England,NA,NA,NA,NA,0
"Hosking, Mr. George Fox",male,36,engineering crew,B,England,NA,NA,NA,NA,0
"House, Mr. William John",male,38,victualling crew,B,England,NA,NA,NA,NA,0
"Howell, Mr. Arthur Albert",male,31,victualling crew,B,England,NA,NA,NA,NA,0
"Hughes, Mr. William Thomas",male,34,victualling crew,S,England,NA,NA,NA,NA,0
"Humby, Mr. Frederick Charles",male,18,victualling crew,S,England,NA,NA,NA,NA,0
"Humphreys, Mr. Humphrey",male,32,victualling crew,S,England,NA,NA,NA,NA,0
"Humphreys, Mr. Sidney",male,53,deck crew,S,England,NA,NA,NA,NA,1
"Hunt, Mr. Albert Sylvanus",male,23,engineering crew,S,England,NA,NA,NA,NA,1
"Hunt, Mr. Tom",male,27,engineering crew,S,England,NA,NA,NA,NA,0
"Hurst, Mr. Charles John",male,41,engineering crew,S,England,NA,NA,NA,NA,0
"Hurst, Mr. Walter",male,23,engineering crew,S,England,NA,NA,NA,NA,1
"Hutchinson, Mr. James",male,31,victualling crew,S,England,NA,NA,NA,NA,0
"Hutchinson, Mr. John Hall",male,28,deck crew,B,England,NA,NA,NA,NA,0
"Hyland, Mr. James Leo",male,19,victualling crew,S,England,NA,NA,NA,NA,1
"Ide, Mr. Harry John",male,31,victualling crew,S,England,NA,NA,NA,NA,0
"Ingram, Mr. George",male,19,engineering crew,S,England,NA,NA,NA,NA,0
"Ingrouille, Mr. Henry",male,21,victualling crew,S,England,NA,NA,NA,NA,0
"Ings, Mr. William Ernest",male,20,victualling crew,S,England,NA,NA,NA,NA,0
"Instance, Mr. T.",male,33,engineering crew,S,England,NA,NA,NA,NA,0
"Jackopson, Mr. John Henry",male,30,engineering crew,S,England,NA,NA,NA,NA,0
"Jackson, Mr. Cecil",male,22,victualling crew,B,England,NA,NA,NA,NA,0
"Jago, Mr. Joseph",male,59,engineering crew,S,England,NA,NA,NA,NA,0
"Jaillet, Mr. Henri Marie",male,38,restaurant staff,S,France,NA,NA,NA,NA,0
"James, Mr. Thomas",male,27,engineering crew,S,Wales,NA,NA,NA,NA,0
"Janaway, Mr. William Frank",male,35,victualling crew,B,England,NA,NA,NA,NA,0
"Janin, Mr. Claude Marie",male,29,restaurant staff,S,England,NA,NA,NA,NA,0
"Jeffery, Mr. William Alfred",male,28,restaurant staff,S,England,NA,NA,NA,NA,0
"Jenner, Mr. Thomas Henry (Harry)",male,55,victualling crew,B,England,NA,NA,NA,NA,0
"Jensen, Mr. Charles Valdemar",male,25,victualling crew,S,England,NA,NA,NA,NA,0
"Jessop, Miss. Violet Constance",female,24,victualling crew,S,England,NA,NA,NA,NA,1
"Jewell, Mr. Archie",male,23,deck crew,B,England,NA,NA,NA,NA,1
"Joas, Mr. N.",male,38,engineering crew,S,England,NA,NA,NA,NA,0
"Johnston, Mr. James",male,41,victualling crew,B,England,NA,NA,NA,NA,1
"Jones, Mr. Albert Hugh Brabner",male,17,victualling crew,S,England,NA,NA,NA,NA,0
"Jones, Mr. Arthur Ernest",male,37,victualling crew,S,England,NA,NA,NA,NA,0
"Jones, Mr. Harry Owen G.",male,29,victualling crew,S,England,NA,NA,NA,NA,0
"Jones, Mr. Thomas William",male,32,deck crew,S,England,NA,NA,NA,NA,1
"Jones, Mr. Victor Reginald",male,21,victualling crew,S,England,NA,NA,NA,NA,0
"Jouannault, Mr. Georges Jules",male,24,restaurant staff,S,England,NA,NA,NA,NA,0
"Joughin, Mr. Charles John",male,32,victualling crew,B,England,NA,NA,NA,NA,1
"Judd, Mr. Charles Edward",male,31,engineering crew,S,England,NA,NA,NA,NA,1
"Jukes, Mr. Henry James",male,38,engineering crew,S,England,NA,NA,NA,NA,0
"Jupe, Mr. Boykett Herbert",male,30,engineering crew,S,England,NA,NA,NA,NA,0
"Kasper, Mr. Franz Wilhelm",male,40,engineering crew,S,England,NA,NA,NA,NA,1
"Kearl, Mr. Charles Henry",male,44,engineering crew,S,England,NA,NA,NA,NA,0
"Kearl, Mr. George Edward",male,25,engineering crew,S,England,NA,NA,NA,NA,0
"Keen, Mr. Percy Edward",male,30,victualling crew,S,England,NA,NA,NA,NA,1
"Kelland, Mr. Thomas",male,18,victualling crew,S,England,NA,NA,NA,NA,0
"Kelly, Mr. William",male,23,engineering crew,B,Scotland,NA,NA,NA,NA,0
"Kemish, Mr. George",male,22,engineering crew,S,England,NA,NA,NA,NA,1
"Kemp, Mr. Thomas Hulman",male,43,engineering crew,B,England,NA,NA,NA,NA,0
"Kenchenten, Mr. Frederick Charles",male,37,engineering crew,S,England,NA,NA,NA,NA,0
"Kennell, Mr. Charles",male,30,victualling crew,S,England,NA,NA,NA,NA,0
"Kenzler, Mr. August",male,44,engineering crew,B,England,NA,NA,NA,NA,0
"Kerley, Mr. William Thomas",male,28,victualling crew,S,England,NA,NA,NA,NA,0
"Kerr, Mr. Thomas Russell",male,26,engineering crew,S,Scotland,NA,NA,NA,NA,0
"Ketchley, Mr. Henry",male,36,victualling crew,B,England,NA,NA,NA,NA,0
"Kieran, Mr. Edgar Michael",male,34,victualling crew,S,Ireland,NA,NA,NA,NA,0
"Kieran, Mr. James William",male,35,victualling crew,S,England,NA,NA,NA,NA,0
"King, Mr. Alfred John Moffett",male,18,victualling crew,S,England,NA,NA,NA,NA,0
"King, Mr. Ernest Waldron",male,28,victualling crew,S,Ireland,NA,NA,NA,NA,0
"King, Mr. G.",male,20,victualling crew,S,England,NA,NA,NA,NA,0
"King, Mr. Thomas Walter",male,42,deck crew,S,England,NA,NA,NA,NA,0
"Kingscote, Mr. William Ford",male,48,victualling crew,S,England,NA,NA,NA,NA,0
"Kinsella, Mr. Louis",male,30,engineering crew,S,England,NA,NA,NA,NA,0
"Kirkaldy, Mr. Thomas Benjamin",male,36,victualling crew,S,England,NA,NA,NA,NA,0
"Kirkham, Mr. James",male,43,engineering crew,S,England,NA,NA,NA,NA,0
"Kitching, Mr. Arthur Alfred",male,31,victualling crew,S,England,NA,NA,NA,NA,0
"Klein, Mr. Herbert",male,33,victualling crew,S,England,NA,NA,NA,NA,0
"Knight, Mr. George",male,49,victualling crew,S,England,NA,NA,NA,NA,1
"Knight, Mr. Leonard George",male,21,victualling crew,S,England,NA,NA,NA,NA,0
"Knowles, Mr. Thomas",male,43,engineering crew,S,England,NA,NA,NA,NA,1
"Lacey, Mr. Bertie William",male,20,victualling crew,S,England,NA,NA,NA,NA,0
"Lahy, Mr. T.",male,41,engineering crew,S,England,NA,NA,NA,NA,0
"Lake, Mr. William",male,46,victualling crew,B,England,NA,NA,NA,NA,0
"Lane, Mr. Albert Edward",male,34,victualling crew,S,England,NA,NA,NA,NA,0
"Latimer, Mr. Andrew",male,55,victualling crew,B,England,NA,NA,NA,NA,0
"Lavington, Miss. Elizabeth",female,40,victualling crew,S,England,NA,NA,NA,NA,1
"Lawrence, Mr. Arthur",male,36,victualling crew,B,England,NA,NA,NA,NA,0
"Leader, Mr. Archibald",male,22,victualling crew,S,England,NA,NA,NA,NA,0
"Leather, Mrs. Elizabeth Mary",female,50,victualling crew,S,England,NA,NA,NA,NA,1
"Lee, Mr. H.",male,18,engineering crew,S,England,NA,NA,NA,NA,0
"Lee, Mr. Henry Reginald",male,29,victualling crew,S,England,NA,NA,NA,NA,1
"Lee, Mr. Reginald Robinson",male,41,deck crew,S,England,NA,NA,NA,NA,1
"Lefebvre, Mr. Paul Georges",male,35,victualling crew,S,England,NA,NA,NA,NA,0
"Leonard, Mr. Matthew",male,25,victualling crew,B,United States,NA,NA,NA,NA,0
"Levett, Mr. George Alfred",male,26,victualling crew,B,England,NA,NA,NA,NA,0
"Lewis, Mr. Arthur Ernest Read",male,27,victualling crew,S,England,NA,NA,NA,NA,1
"Light, Mr. Charles Edward",male,24,victualling crew,S,England,NA,NA,NA,NA,0
"Light, Mr. Christopher William",male,20,engineering crew,S,England,NA,NA,NA,NA,0
"Light, Mr. W.",male,47,engineering crew,S,England,NA,NA,NA,NA,0
"Lightoller, Mr. Charles Herbert",male,38,deck crew,B,England,NA,NA,NA,NA,1
"Lindsay, Mr. William Charles",male,30,engineering crew,S,England,NA,NA,NA,NA,1
"Littlejohn, Mr. Alexander James",male,40,victualling crew,B,England,NA,NA,NA,NA,1
"Lloyd, Mr. Humphrey",male,41,victualling crew,B,England,NA,NA,NA,NA,0
"Lloyd, Mr. William",male,29,engineering crew,S,England,NA,NA,NA,NA,0
"Locke, Mr. A.",male,33,victualling crew,S,England,NA,NA,NA,NA,0
"Long, Mr. Frank",male,31,engineering crew,S,England,NA,NA,NA,NA,0
"Long, Mr. William",male,36,engineering crew,S,England,NA,NA,NA,NA,0
"Longmuir, Mr. John Dickson",male,20,victualling crew,S,England,NA,NA,NA,NA,0
"Lovell, Mr. John",male,37,victualling crew,S,England,NA,NA,NA,NA,0
"Lowe, Mr. Harold Godfrey",male,29,deck crew,B,Wales,NA,NA,NA,NA,1
"Lucas, Mr. William Arthur",male,25,deck crew,S,England,NA,NA,NA,NA,1
"Lucas, Mr. William Watson",male,31,victualling crew,B,England,NA,NA,NA,NA,1
"Lydiatt, Mr. Charles",male,45,victualling crew,S,England,NA,NA,NA,NA,0
"Lyons, Mr. William Henry",male,26,deck crew,S,Ireland,NA,NA,NA,NA,0
"Mabey, Mr. John Charles",male,24,victualling crew,S,England,NA,NA,NA,NA,0
"MacKie, Mr. George William",male,34,victualling crew,S,England,NA,NA,NA,NA,0
